Passcode,Name,Status,Attribute,type,link,link_arrows,rank,pendulum_scale,level,attack,defense,spell_attribute,summoning_condition,pendulum_condition,card_text,card_supports,card_anti_supports,card_actions,effect_types,
35537860,Vague Mentale Fréquentielle,Unlimited(OCG)/Unlimited(TCG),MAGIE,,,,,,,,,,,,Si vous contrôlez un Monstre Synchro : ciblez 1 monstre contrôlé par votre adversaire ; détruisez la cible.,Synchro Monster,,,Activation requirement/Effect,
09365703,Guerrier de Célérité,Unlimited(OCG)/Unlimited(TCG),VENT,[Guerrier/Effet],,,,,Niveau 2,900,400,,,,"Une fois par Battle Phase, si cette carte a été Invoquée Normalement ce tour (sauf durant la Damage Step) : jusqu'à la fin de la Battle Phase, vous pouvez faire devenir son ATK le double de son ATK d'origine.",,,Activates during the turn in which it was Normal Summoned,Trigger,
51630558,Pioche Évoluée,Unlimited(OCG)/Unlimited(TCG),MAGIE,,,,,,,,,,,,Sacrifiez 1 monstre de min. Niveau 8 face recto que vous contrôlez ; piochez 2 cartes.,,,Tributes for cost/You draw cards,Cost/Effect,
57421866,Dévoreur de Niveau,Forbidden(OCG)/Forbidden(TCG),TÉNÈBRES,[Insecte/Effet],,,,,Niveau 1,600,0,,,,"Si cette carte est dans votre Cimetière : vous pouvez cibler 1 monstre de min. Niveau 5 que vous contrôlez ; réduisez son Niveau de 1, et si vous le faites, Invoquez Spécialement cette carte. Cette carte face recto sur le Terrain ne peut pas être Sacrifiée, sauf pour une Invocation Sacrifice.",,,Activates from your Graveyard/Cannot be Tributed,Ignition/Continuous,
02295440,Un pour Un,Limited(OCG)/Limited(TCG),MAGIE,,,,,,,,,,,,Envoyez 1 monstre depuis votre main au Cimetière ; Invoquez Spécialement 1 monstre de Niveau 1 depuis votre main ou Deck.,,,Sends from hand to Graveyard for cost,Cost/Effect,
98427577,Épouvantail de Ferraille,Unlimited(OCG)/Unlimited(TCG),PIÈGE,,,,,,,,,,,,"Lorsqu'un monstre de l'adversaire déclare une attaque : ciblez le monstre attaquant ; annulez l'attaque, et aussi, après ça, Posez cette carte face verso au lieu de l'envoyer au Cimetière.",,,Activates upon attack declaration/Flips itself face-down,Activation requirement/Effect,
