Passcode,Name,Status,Attribute,type,link,link_arrows,rank,pendulum_scale,level,attack,defense,spell_attribute,summoning_condition,pendulum_condition,card_text,card_supports,card_anti_supports,card_actions,effect_types,
38898779,Guerrier Colossal/Mode Assaut,Unlimited(OCG)/Unlimited(TCG),TÉNÈBRES,[Guerrier/Effet],,,,,Niveau 10,3300,1500,,,,"Cette carte ne peut ni être Invoquée Normalement ni être Posée. Cette carte ne peut pas être Invoquée Spécialement, excepté avec ""Activation Mode Assaut"". Lorsque cette carte est Invoquée Spécialement, vous pouvez envoyer jusqu'à 2 monstres de Type Guerrier depuis votre Deck au Cimetière. Tous les monstres contrôlés par votre adversaire perdent 100 points d'ATK pour chaque monstre de Type Guerrier dans votre Cimetière. Lorsque cette carte sur le Terrain est détruite, vous pouvez Invoquer Spécialement 1 ""Guerrier Colossal"" depuis votre Cimetière.",Warrior/Colossal Fighter/Assault Mode Activate,,Sends from your Deck to your Graveyard,Summon/Trigger/Continuous,
88559132,Guerrier Tourelle,Unlimited(OCG)/Unlimited(TCG),TERRE,[Guerrier/Effet],,,,,Niveau 5,1200,2000,,,,"Vous pouvez Invoquer Spécialement cette carte (depuis votre main) en Sacrifiant 1 monstre de Type Guerrier, et si vous le faites, elle gagne une ATK égale à l'ATK d'origine du monstre Sacrifié.",Warrior,,Activates from your hand/Tributes for cost,Summon,
40348946,Robot Hyper Synchronique,Unlimited(OCG)/Unlimited(TCG),LUMIÈRE,[Machine/Syntoniseur／Effet],,,,,Niveau 4,1600,800,,,,"Si cette carte est envoyée au Cimetière pour l'Invocation Synchro d'un monstre de Type Dragon : le monstre gagne 800 ATK, et aussi, bannissez le monstre face recto durant la End Phase.",Dragon,,Activates from your Graveyard/Activates if used as Synchro Material,Trigger,
13821299,Mangeur de Piège,Unlimited(OCG)/Unlimited(TCG),TÉNÈBRES,[Démon/Syntoniseur／Effet],,,,,Niveau 4,1900,1600,,,,Ni Invocable Normalement ni Posable Normalement. Uniquement Invocable Spécialement (depuis votre main) en envoyant 1 Piège face recto contrôlé par votre adversaire au Cimetière.,,,Sends from field to Graveyard for cost/Sends from your opponent's field to your opponent's Graveyard,Summon,
02009101,Aile Noire - Mistral le Tourbillon,Unlimited(OCG)/Unlimited(TCG),TÉNÈBRES,[Bête Ailée/Syntoniseur／Effet],,,,,Niveau 3,1300,400,,,,"Si vous contrôlez un monstre ""Aile Noire"" (""Aile Noire - Mistral le Tourbillon"" exclu), vous pouvez Invoquer Spécialement cette carte (depuis votre main). Une fois par tour : vous pouvez cibler 1 monstre face recto contrôlé par votre adversaire ; l'ATK/DEF de la cible deviennent la moitié de son ATK/DEF actuelles.",Supports archetypes /Blackwing,,,Summon/Ignition,
49003716,Aile Noire - Bora la Lance,Unlimited(OCG)/Unlimited(TCG),TÉNÈBRES,[Bête Ailée/Effet],,,,,Niveau 4,1700,800,,,,"Si vous contrôlez un monstre ""Aile Noire"" (""Aile Noire - Bora la Lance"" exclu), vous pouvez Invoquer Spécialement cette carte (depuis votre main). Si cette carte attaque un monstre en Position de Défense, infligez des dommages de combat perçants.",Supports archetypes /Blackwing,,,Summon/Continuous,
75498415,Aile Noire - Sirocco l'Aube,Unlimited(OCG)/Unlimited(TCG),TÉNÈBRES,[Bête Ailée/Effet],,,,,Niveau 5,2000,900,,,,"Si uniquement votre adversaire contrôle un monstre, vous pouvez Invoquer/Poser Normalement cette carte sans Sacrifice. Une fois par tour, durant votre Main Phase 1 : vous pouvez cibler 1 monstre ""Aile Noire"" que vous contrôlez ; jusqu'à la fin de ce tour, il gagne une ATK égale à la somme des ATK de tous les autres monstres ""Aile Noire"" actuellement sur le Terrain (lui-même exclu), et aussi, le reste de ce tour, vous ne pouvez attaquer qu'avec le monstre.",Supports archetypes /Blackwing,Anti-supports archetypes /Blackwing,,Summon/Ignition/Condition,
02986553,Chevalier de la Rose du Crépuscule,Unlimited(OCG)/Unlimited(TCG),TÉNÈBRES,[Guerrier/Syntoniseur／Effet],,,,,Niveau 3,1000,1000,,,,Les monstres contrôlés par votre adversaire ne peuvent pas cibler de monstres Plante avec une attaque. Lorsque cette carte est Invoquée Normalement : vous pouvez Invoquer Spécialement 1 monstre Plante de max. Niveau 4 depuis votre main.,Plant,,,Continuous/Trigger,
89493368,Réacteur d'Invocation ・FEU,Unlimited(OCG)/Unlimited(TCG),TÉNÈBRES,[Machine/Effet],,,,,Niveau 5,2000,1400,,,,"La première fois qu'un (ou plusieurs) monstre(s) est (sont) Invoqué(s) sur le Terrain de votre adversaire à chaque tour, infligez 800 points de dommages à votre adversaire. Durant la Battle Phase du tour où cet effet est activé, vous pouvez annuler l'attaque d'1 monstre contrôlé par votre adversaire. Vous pouvez envoyer 1 ""Réacteur de Piège ・DU"" face recto, 1 ""Réacteur de Magie ・CIEL"" face recto et cette carte face recto que vous contrôlez au Cimetière pour Invoquer Spécialement 1 ""Forteresse Volante FEU DU CIEL"" depuis votre main, Deck ou Cimetière.",Trap Reactor・Y FI/Spell Reactor・RE/Flying Fortress SKY FIRE,,Activates upon Normal Summon/Activates upon Flip Summon/Activates upon Special Summon/Sends from field to Graveyard for cost/Sends itself from field to Graveyard for cost,Trigger/Ignition,
52286175,Réacteur de Piège ・DU,Unlimited(OCG)/Unlimited(TCG),TÉNÈBRES,[Machine/Effet],,,,,Niveau 4,800,1800,,,,"Une fois par tour, lorsque votre adversaire active une Carte Piège, vous pouvez détruire la Carte Piège et infliger 800 points de dommages à votre adversaire.",,,,Trigger,
15175429,Réacteur de Magie ・CIEL,Unlimited(OCG)/Unlimited(TCG),TÉNÈBRES,[Machine/Effet],,,,,Niveau 3,1200,900,,,,"Une fois par tour, lorsque votre adversaire active une Carte Magie, vous pouvez détruire la Carte Magie et infliger 800 points de dommages à votre adversaire.",,,,Trigger,
16898077,Forteresse Volante FEU DU CIEL,Unlimited(OCG)/Unlimited(TCG),VENT,[Machine/Effet],,,,,Niveau 8,3000,2500,,,,"Cette carte ne peut ni être Invoquée Normalement ni être Posée. Cette carte ne peut pas être Invoquée Spécialement, excepté par l'effet de ""Réacteur d'Invocation ・FEU"". Une fois par tour, vous pouvez envoyer 1 carte depuis votre main au Cimetière pour détruire 1 carte contrôlée par votre adversaire. Une fois durant chaque tour de votre adversaire, vous pouvez activer 1 des effets suivants : ●Lorsque votre adversaire Invoque Normalement ou Spécialement un monstre, détruisez-le et infligez 800 points de dommages à votre adversaire. ●Lorsque votre adversaire Pose une carte, détruisez-la et infligez 800 points de dommages à votre adversaire.",Summon Reactor・SK,,Sends from hand to Graveyard for cost/Activates upon Normal Summon/Activates upon Flip Summon/Activates upon Special Summon,Summon/Ignition/Quick,
48381268,Planchon Morphtronique,Unlimited(OCG)/Unlimited(TCG),TERRE,[Machine/Effet],,,,,Niveau 3,500,1800,,,,"●En Position d'Attaque : Les monstres ""Morphtronique"" que vous contrôlez peuvent attaquer votre adversaire directement. ●En Position de Défense : Les autres monstres ""Morphtronique"" que vous contrôlez ne peuvent pas être détruits au combat.",Supports archetypes /Morphtronic,,,Continuous,
75775867,Frondon Morphtronique,Unlimited(OCG)/Unlimited(TCG),VENT,[Machine/Effet],,,,,Niveau 4,1200,800,,,,"●En Position d'Attaque : Une fois par tour, vous pouvez Sacrifier 1 monstre ""Morphtronique"", excepté ""Frondon Morphtronique"", pour détruire 1 carte sur le Terrain. ●En Position de Défense : Si cette carte doit être détruite, vous pouvez détruire un autre monstre ""Morphtronique"" que vous contrôlez à la place.",Supports archetypes /Morphtronic,,Tributes for cost,Ignition/Continuous,
37169670,Artilleur Hyper Psychique/Mode Assaut,Unlimited(OCG)/Unlimited(TCG),TERRE,[Psychique/Effet],,,,,Niveau 11,3500,3000,,,,"Cette carte ne peut ni être Invoquée Normalement ni être Posée. Cette carte ne peut pas être Invoquée Spécialement, excepté avec ""Activation Mode Assaut"". Si cette carte combat un monstre, à la fin de la Damage Step, infligez des dommages à votre adversaire égaux à la DEF de ce monstre et gagnez un montant de Life Points égal à son ATK. Lorsque cette carte sur le Terrain est détruite, vous pouvez Invoquer Spécialement 1 ""Artilleur Hyper Psychique"" depuis votre Cimetière.",Hyper Psychic Blaster/Assault Mode Activate,,,Summon/Trigger,
77036039,Mercenaire d'Assaut,Unlimited(OCG)/Unlimited(TCG),TERRE,[Guerrier/Effet],,,,,Niveau 4,1800,300,,,,"Une fois par tour, vous pouvez renvoyer 1 ""Activation Mode Assaut"" depuis votre main ou Cimetière au Deck pour détruire 1 Carte Magie ou Piège contrôlée par votre adversaire.",Assault Mode Activate,,Returns from hand to Deck for cost/Returns from Graveyard to Deck for cost,Ignition,
49826746,Sorcière aux Ailes de Nuit,Unlimited(OCG)/Unlimited(TCG),VENT,[Magicien/Effet],,,,,Niveau 3,1300,1200,,,,"Vous pouvez activer ""Activation Mode Assaut"" le tour où il est Posé.",Assault Mode Activate,,,Continuous,
76214441,Harmonisateur de Force Vitale,Unlimited(OCG)/Unlimited(TCG),VENT,[Psychique/Effet],,,,,Niveau 2,800,400,,,,"Lorsque votre adversaire active l'effet d'une carte qui inflige des dommages, vous pouvez défausser cette carte pour annuler son activation et la détruire.",,,Discards itself for cost,Quick,
81278754,Grenouille Flip Flap,Unlimited(OCG)/Unlimited(TCG),EAU,[Aqua/Effet],,,,,Niveau 2,500,200,,,,"Une fois par tour, vous pouvez retourner cette carte en Position de Défense face verso. Lorsque cette carte est retournée face recto, vous pouvez renvoyer les monstres contrôlés par votre adversaire dans la main de leur propriétaire jusqu'au nombre de monstres ""Grenouille"" ou ""Rainette"" face recto que vous contrôlez, excepté ""Grenouille, la Bave"".",Supports archetypes /Frog,,Flips itself face-down/Changes battle positions/Returns from field to hand,Ignition/Trigger,
75937826,B.E.S. Grand Vaisseau MK-2,Unlimited(OCG)/Unlimited(TCG),FEU,[Machine/Effet],,,,,Niveau 6,2400,1100,,,,"Si vous ne contrôlez aucun monstre, vous pouvez Invoquer Normalement cette carte sans Sacrifice. Lorsque cette carte est Invoquée Spécialement, placez 3 compteurs sur elle. Cette carte ne peut pas être détruite au combat. Si cette carte attaque ou est attaquée, retirez 1 compteur de cette carte à la fin de la Damage Step. Si vous ne pouvez pas, détruisez-la.",,,Activates upon Special Summon,Summon/Trigger/Continuous,
75198893,Scanner,Unlimited(OCG)/Unlimited(TCG),LIGHT,[Machine/Effect],,,,,1,?,?,,,,"Once per turn, you can select 1 of your opponent's monsters that is removed from play. Until the End Phase, this card's name is treated as the selected monster's name, and this card has the same Attribute, Level, ATK, and DEF as the selected monster. If this card is removed from the field while this effect is applied, remove it from play.",,,,Ignition/Condition,
01596508,Forteresse Arsenal Dimensionnelle,Unlimited(OCG)/Unlimited(TCG),TÉNÈBRES,[Machine/Effet],,,,,Niveau 4,1700,200,,,,Les cartes ne peuvent pas être envoyées du Deck au Cimetière.,,,Prevents sending cards from Deck to Graveyard,Continuous,
38981606,Protecteur du Désert,Unlimited(OCG)/Unlimited(TCG),TERRE,[Insecte/Effet],,,,,Niveau 4,800,1000,,,,"Cette carte gagne 300 points de DEF pour chaque Carte Magie et Piège sur le Terrain. Si un monstre de Type Insecte que vous contrôlez doit être détruit, vous pouvez détruire cette carte à la place.",Insect,,,Continuous,
74976215,Scarabée Chasseur,Unlimited(OCG)/Unlimited(TCG)/Unlimited(TCGSpeed Duel),VENT,[Insecte/Effet],,,,,Niveau 4,1800,1200,,,,"Tant que vous contrôlez un autre monstre Insecte, si un monstre Insecte que vous contrôlez attaque un monstre en Position de Défense, infligez des dommages de combat perçants à votre adversaire.",Insect,,,Continuous,
69031175,Aile Noire - Maître des Armures,Unlimited(OCG)/Unlimited(TCG),TÉNÈBRES,[Bête Ailée/Synchro／Effet],,,,,Niveau 7,2500,1500,,"1 Syntoniseur ""Aile Noire"" + 1+ monstre non-Syntoniseur",,"Non destructible au combat, et vous ne recevez aucun dommage de combat d'attaques impliquant cette carte. À la fin de la Damage Step, si cette carte a attaqué un monstre : vous pouvez placer 1 Compteur Cuirasse sur le monstre (max. 1). Vous pouvez retirer tous les Compteurs Cuirasse des monstres de votre adversaire ; jusqu'à la fin de ce tour, l'ATK/DEF de ces monstres qui avaient des Compteurs Cuirasse deviennent 0.",Supports archetypes /Blackwing,,,Continuous/Trigger/Ignition,
95526884,Artilleur Hyper Psychique,Unlimited(OCG)/Unlimited(TCG),TERRE,[Psychique/Synchro／Effet],,,,,Niveau 9,3000,2500,,1 Syntoniseur + 1 monstre non-Syntoniseur de Type Psychique ou plus,,"Si cette carte attaque un monstre en Position de Défense, infligez des dommages de combat perçants à votre adversaire. À la fin de la Damage Step, si cette carte attaque un monstre en Position de Défense et que la DEF du monstre est inférieure à l'ATK de cette carte (utilisez ses valeurs d'origine si l'autre monstre n'est plus sur le Terrain) : gagnez des LP égaux au surplus.",Psychic,,,Continuous/Trigger,
68319538,Gol'gar la Forteresse Cosmique,Unlimited(OCG)/Unlimited(TCG),LUMIÈRE,[Reptile/Synchro／Effet],,,,,Niveau 5,2600,1800,,"Ammonite Alien + 1 monstre non Syntoniseur ""Alien"" ou plus",,"Une fois par tour, vous pouvez sélectionner un nombre de votre choix de Cartes Magie ou Piège face recto. Renvoyez ces cartes dans la main de leur propriétaire et distribuez de nouveaux Compteurs-A parmi les monstres sur le Terrain équivalents au nombre de cartes renvoyées. Une fois par tour, vous pouvez retirer 2 Compteurs-A du Terrain pour détruire 1 carte contrôlée par votre adversaire.",Supports archetypes /Alien,,Returns from field to hand/Distributes A-Counter,Ignition,
94303232,Étoile de Vigilance,Unlimited(OCG)/Unlimited(TCG),MAGIE,,,,,,,,,,,,"Équipable uniquement à un monstre que vous contrôlez, s'il a été changé de Position d'Attaque face recto en Position de Défense face recto ce tour. Sélectionnez 1 monstre contrôlé par votre adversaire. Ce monstre ne peut pas attaquer ou changer sa position de combat. Lorsque le monstre équipé est détruit et que cette carte est envoyée au Cimetière, retirez du jeu le monstre sélectionné.",,,Prevents Battle Position changes/Activates from your Graveyard,Condition/Continuous-like/Trigger-like,
20686759,Moteur Rouillé Morphtronique,Unlimited(OCG)/Unlimited(TCG),MAGIE,,,,,,,,,,,,"Équipable uniquement à un monstre ""Morphtronique"". Si le monstre équipé est détruit, infligez des dommages à chaque joueur égaux à son ATK d'origine.",Supports archetypes /Morphtronic,,,Condition/Trigger-like,
56074358,Plan Morphtronique,Unlimited(OCG)/Unlimited(TCG),MAGIE,,,,,,,,,,,,"Chaque fois que la position de combat d'un monstre est changée, placez 1 Compteur Morph sur cette carte. Tous les monstres ""Morphtronique"" gagnent 300 points d'ATK pour chaque Compteur Morph sur cette carte. Lorsque cette carte est détruite et envoyée du Terrain au Cimetière, vous pouvez Invoquer Spécialement 1 monstre ""Morphtronique"" depuis votre Cimetière.",Supports archetypes /Morphtronic,,Activates if battle positions change/Activates from your Graveyard,Continuous-like/Trigger-like,
92346415,Épée Psychique,Unlimited(OCG)/Unlimited(TCG),MAGIE,,,,,,,,,,,,"Équipable uniquement à un monstre de Type Psychique. Tant que vos LP sont inférieurs à ceux de votre adversaire, le monstre équipé gagne une ATK égale à la différence (max. 2000).",Psychic,,,Condition/Continuous-like,
55136228,Courage des Bêtes Gladiateurs,Unlimited(OCG)/Unlimited(TCG),MAGIE,,,,,,,,,,,,"Ciblez un monstre ""Bête Gladiateur"" face recto que vous contrôlez, il gagne 500 points d'ATK jusqu'à la End Phase. Tant que cette carte est dans votre Cimetière, vous pouvez renvoyer 2 cartes ""Bête Gladiateur"" depuis votre Cimetière au Deck pour renvoyer cette carte à votre main.",Supports archetypes /Gladiator Beast,,Returns itself from Graveyard to hand/Returns from Graveyard to Deck for cost/Activates from your Graveyard,Effect/Ignition-like,
81524977,Canon à Graines,Unlimited(OCG)/Unlimited(TCG),MAGIE,,,,,,,,,,,,"Chaque fois qu'un (ou plusieurs) monstre(s) de Type Plante est (sont) Invoqué(s), placez 1 Compteur Plante sur cette carte (max. 5). Vous pouvez envoyer cette carte au Cimetière pour infliger 500 points de dommages à votre adversaire pour chaque Compteur Plante sur elle.",Plant,Plant,Sends itself from field to Graveyard for cost,Continuous-like/Ignition-like,
54913680,Six Parchemins des Samouraïs (Actualisé de : Parchemins des Six Samouraïs),Unlimited(OCG)/Unlimited(TCG),MAGIE,,,,,,,,,,,,"Sacrifiez 2 monstres ""Six Samouraïs"" face recto. Invoquez Spécialement 1 ""Grand Shogun Shien"" depuis votre Deck.",Supports archetypes /Six Samurai,,Tributes for cost,Cost/Effect,
53291093,Triangle Mystérieux,Unlimited(OCG)/Unlimited(TCG),MAGIE,,,,,,,,,,,,"Détruisez 1 monstre sur le Terrain avec un Compteur-A. Ensuite, vous pouvez Invoquer Spécialement 1 monstre ""Alien"" de Niveau 4 depuis votre Deck. Détruisez-le durant la End Phase.",Supports archetypes /Alien,,,Effect/Condition,
89563150,Force d'Argent Flamboyante,Unlimited(OCG)/Unlimited(TCG),PIÈGE,,,,,,,,,,,,Activable uniquement lorsque votre adversaire active une Carte Piège qui inflige des dommages. Annulez l'activation de cette carte et détruisez-la ainsi que toutes les Cartes Magie et Piège face recto contrôlées par votre adversaire.,,,,Activation requirement/Effect,
15552258,La Moitié ou Rien,Unlimited(OCG)/Unlimited(TCG),PIÈGE,,,,,,,,,,,,"Durant la Battle Phase de votre adversaire (sauf durant la Damage Step) : votre adversaire choisit 1 de ces effets. ●Jusqu'à la fin de la Battle Phase, divisez par deux l'ATK de tous les monstres qu'il contrôle actuellement. ●Terminez la Battle Phase.",,,Ends the Battle Phase,Activation requirement/Effect,
42956963,Archdémons du Cauchemar,Unlimited(OCG)/Unlimited(TCG),PIÈGE,,,,,,,,,,,,"Sacrifiez 1 monstre ; Invoquez Spécialement 3 ""Jeton Archdémon du Cauchemar"" (Type Démon/TÉNÈBRES/Niveau 6/ATK 2000/DEF 2000) sur le Terrain de votre adversaire en Position d'Attaque. Chaque fois qu'1 est détruit, son contrôleur reçoit 800 points de dommages.",,,Tributes for cost,Cost/Effect/Lingering,
88341502,Flèche d'Ébène,Unlimited(OCG)/Unlimited(TCG),PIÈGE,,,,,,,,,,,,"Sélectionnez 1 monstre face recto que vous contrôlez. Jusqu'à la End Phase, il perd 500 ATK et durant un combat entre cette carte attaquant et un monstre en Position de Défense dont la DEF est inférieure à l'ATK du monstre sélectionné, infligez la différence en tant que dommages de combat à votre adversaire. Lorsque le monstre sélectionné détruit un monstre au combat et l'envoie au Cimetière ce tour, infligez des dommages à votre adversaire égaux à la DEF d'origine du monstre détruit.",,,,Effect/Trigger-like,
14730606,Prison de Lierre,Unlimited(OCG)/Unlimited(TCG),PIÈGE,,,,,,,,,,,,Tous les monstres face recto contrôlés par votre adversaire deviennent de Type Plante durant vos tours uniquement. Si cette carte face recto que vous contrôlez est détruite et envoyée à votre Cimetière par un effet de carte de votre adversaire : piochez 1 carte.,,,You draw cards,Continuous-like/Trigger-like,
41234315,Explosion Factice,Unlimited(OCG)/Unlimited(TCG),PIÈGE,,,,,,,,,,,,"Activable uniquement lorsqu'un monstre de votre adversaire déclare une attaque. Les monstres ne peuvent pas être détruits durant ce combat. Après le calcul des dommages, Invoquez Spécialement 1 ""Réacteur d'Invocation ・FEU"" depuis votre main ou Cimetière.",Summon Reactor・SK,,Activates upon attack declaration,Activation requirement/Effect/Trigger-like,
77229910,Champ de Force Morphtronique,Unlimited(OCG)/Unlimited(TCG),PIÈGE,,,,,,,,,,,,"Annulez l'activation d'une Carte Magie ou Piège qui doit détruire un monstre ""Morphtronique"" face recto que vous contrôlez et détruisez-la. Ajoutez 1 carte ""Morphtronique"" depuis votre Deck à votre main.",Supports archetypes /Morphtronic,,Adds from Deck to hand,Effect,
14613029,Confusion Morphtronique,Unlimited(OCG)/Unlimited(TCG),PIÈGE,,,,,,,,,,,,"Si vous contrôlez 2 monstres ""Morphtronique"" face recto ou plus, sélectionnez 2 cartes contrôlées par votre adversaire. Détruisez 1 carte choisie par votre adversaire parmi ces 2.",Supports archetypes /Morphtronic,,,Activation requirement/Effect,
76407432,Contre d'Assaut,Unlimited(OCG)/Unlimited(TCG),PIÈGE,,,,,,,,,,,,"Activable uniquement lorsque vous contrôlez un monstre ""/Mode Assaut"". Annulez l'activation d'une Carte Magie, Carte Piège ou de l'effet d'une carte Monstre à Effet et détruisez cette carte.",Supports archetypes //Assault Mode,,,Activation requirement/Effect,
03891471,Réglage Psychique,Unlimited(OCG)/Unlimited(TCG),PIÈGE,,,,,,,,,,,,"Sélectionnez 1 monstre de Type Psychique dans votre Cimetière et Invoquez-le Spécialement en Position d'Attaque. Il est traité comme un monstre Syntoniseur. Lorsque cette carte est retirée du Terrain, détruisez ce monstre. Lorsque ce monstre est retiré du Terrain, détruisez cette carte. Lorsque cette carte est envoyée au Cimetière, recevez des dommages équivalents au Niveau du monstre x 400.",Psychic,,Activates when it leaves the field/Activates from your Graveyard,Effect/Continuous-like/Trigger-like,
49980185,Régénération Surnaturelle (Actualisé de : Régénération Métaphysique),Unlimited(OCG)/Unlimited(TCG),PIÈGE,,,,,,,,,,,,Activable uniquement durant la End Phase. Gagnez 1000 Life Points pour chaque monstre de Type Psychique envoyé au Cimetière ce tour.,Psychic,,,Activation requirement/Effect,
02779999,Mur d'Épines,Unlimited(OCG)/Unlimited(TCG),PIÈGE,,,,,,,,,,,,Lorsqu'un monstre de Type Plante que vous contrôlez est ciblé par une attaque : détruisez tous les monstres en Position d'Attaque contrôlés par votre adversaire.,Plant,,,Activation requirement/Effect,
37675138,Briseur d'Os,Unlimited(OCG)/Unlimited(TCG),TERRE,[Zombie/Effet],,,,,Niveau 4,1600,200,,,,Lorsque cette carte est Invoquée Spécialement depuis votre Cimetière par l'effet d'un monstre de Type Zombie : vous pouvez cibler 1 Carte Magie/Piège contrôlée par votre adversaire ; détruisez la cible. Durant la End Phase du tour où cette carte a été Invoquée Spécialement : détruisez-la.,Zombie,,,Trigger,
37953640,Anguille Blanche Royale,Unlimited(OCG)/Unlimited(TCG),EAU,[Poisson/Syntoniseur／Effet],,,,,Niveau 4,1700,1200,,,,"Si cette carte est utilisée comme un Monstre-Matériel de Synchro, tous les autres Monstres-Matériels de Synchro doivent être de Type Poisson.",Fish,,,Condition,
27827272,"Makiu, la Brume Mystique",Unlimited(OCG)/Unlimited(TCG),MAGIE,,,,,,,,,,,,"Ciblez 1 ""Crâne Invoqué"" ou 1 monstre Tonnerre dans votre Zone Monstre ; détruisez tous les monstres contrôlés par votre adversaire avec une DEF inférieure ou égale à l'ATK du monstre. Vous ne pouvez pas mener votre Battle Phase le tour où vous activez cette carte.",Summoned Skull/Thunder,,Cannot conduct Battle Phase,Effect/Condition,
87148330,"Téthys, Déesse de la Lumière",Unlimited(OCG)/Unlimited(TCG),LUMIÈRE,[Elfe/Effet],,,,,Niveau 5,2400,1800,,,,Lorsque vous piochez un ou plusieurs monstres Elfe (sauf durant la Damage Step) : vous pouvez révéler 1 de ces monstres ; piochez 1 carte. Cette carte doit être face recto sur le Terrain pour activer et résoudre cet effet.,Fairy,,Reveals your hand for cost/You draw cards,Trigger,
35984222,Ido la Force Magique Suprême,Unlimited(OCG)/Unlimited(TCG),TÉNÈBRES,[Démon/Effet],,,,,Niveau 6,2200,800,,,,"Vous ne pouvez ni Invoquer ni Poser Normalement de monstres. Vous ne pouvez contrôler qu'1 ""Ido la Force Magique Suprême"". Une fois par tour, durant la Standby Phase du prochain tour après que cette carte a été détruite par un effet de carte et envoyée au Cimetière : Invoquez Spécialement cette carte depuis le Cimetière, et si vous le faites, détruisez tous les autres monstres que vous contrôlez.",,,Activates if destroyed by card effect/Activates from your Graveyard,Continuous/Unclassified/Trigger,
73333463,Armoroid,Unlimited(OCG)/Unlimited(TCG),EARTH,[Machine/Effect],,,,,8,2700,2000,,,,"If this card is Tribute Summoned by Tributing at least 1 ""roid"" monster: Banish all Spells and Traps on the field.",Supports archetypes /roid,,Activates upon Tribute Summon,Trigger,
