Passcode,Name,Status,Attribute,type,link,link_arrows,rank,pendulum_scale,level,attack,defense,spell_attribute,summoning_condition,pendulum_condition,card_text,card_supports,card_anti_supports,card_actions,effect_types,
66127916,Réserve de Fusion,Unlimited(OCG)/Unlimited(TCG),PIÈGE,,,,,,,,,,,,"Révélez 1 Monstre de Fusion dans votre Extra Deck, ajoutez 1 des Matériels de Fusion dont le nom est précisément listé sur la carte depuis votre Deck à votre main, puis vous pouvez ajouter 1 ""Polymérisation"" depuis votre Cimetière à votre main.",Fusion Monster/Polymerization/Fusion Material,,Reveals your Extra Deck/Adds from Deck to hand/Adds from Graveyard to hand,Effect,
92512625,Sermon Solennel,Unlimited(OCG)/Unlimited(TCG),PIÈGE,,,,,,,,,,,,"Si c'est la seule carte Posée dans votre Zone Magie & Piège, lorsqu'un monstre va être Invoqué, OU qu'une Carte Magie/Piège ou un effet de monstre est activé : payez 3000 LP ; annulez l'Invocation ou l'activation, et si vous le faites, détruisez le monstre ou la carte.",,,,Activation requirement/Cost/Effect,
00734741,"Rubic, Malebranche des Abysses Ardents",Unlimited(OCG)/Unlimited(TCG),TÉNÈBRES,[Démon/Syntoniseur／Effet],,,,,Niveau 3,100,2100,,,,"Si vous contrôlez un monstre (monstres ""Abysses Ardents"" exclus), détruisez cette carte. Non utilisable comme Matériel de Synchro, sauf pour l'Invocation Synchro d'un Monstre Synchro ""Abysses Ardents"". Si vous ne contrôlez aucune Carte Magie/Piège : vous pouvez Invoquer Spécialement cette carte depuis votre main. Vous ne pouvez utiliser cet effet de ""Rubic, Malebranche des Abysses Ardents"" qu'une fois par tour.",Supports archetypes /Burning Abyss,,,Continuous/Condition/Ignition,
47728740,"Alich, Malebranche des Abysses Ardents",Unlimited(OCG)/Unlimited(TCG),TÉNÈBRES,[Démon/Effet],,,,,Niveau 3,1200,0,,,,"Si vous contrôlez un monstre (monstres ""Abysses Ardents"" exclus), détruisez cette carte. Vous ne pouvez utiliser qu'1 de ces effets de ""Alich, Malebranche des Abysses Ardents"" par tour, et uniquement une fois le tour.●Si vous ne contrôlez aucune Carte Magie/Piège : vous pouvez Invoquer Spécialement cette carte depuis votre main.●Si cette carte est envoyée au Cimetière : vous pouvez cibler 1 monstre face recto sur le Terrain ; jusqu'à la fin de ce tour, annulez ses effets.",Supports archetypes /Burning Abyss,,Activates from your hand/Activates from your Graveyard,Continuous/Condition/Ignition/Trigger,
73213494,"Calcab, Malebranche des Abysses Ardents",Unlimited(OCG)/Unlimited(TCG),TÉNÈBRES,[Démon/Effet],,,,,Niveau 3,1400,0,,,,"Si vous contrôlez un monstre (monstres ""Abysses Ardents"" exclus), détruisez cette carte. Vous ne pouvez utiliser qu'1 de ces effets de ""Calcab, Malebranche des Abysses Ardents"" par tour, et uniquement une fois le tour.●Si vous ne contrôlez aucune Carte Magie/Piège : vous pouvez Invoquer Spécialement cette carte depuis votre main.●Si cette carte est envoyée au Cimetière : vous pouvez cibler 1 Carte Magie/Piège Posée sur le Terrain ; renvoyez la cible à la main.",Supports archetypes /Burning Abyss,,Activates from your Graveyard/Returns from field to hand,Continuous/Condition/Ignition/Trigger,
00601193,"Virgile, Star du Rock des Abysses Ardents",Unlimited(OCG)/Unlimited(TCG),LUMIÈRE,[Magicien/Synchro／Effet],,,,,Niveau 6,2500,1000,,1 Syntoniseur + 1 monstre non-Syntoniseur ou plus,,"Vous ne pouvez contrôler qu'1 ""Virgile, Star du Rock des Abysses Ardents"". Une fois par tour : vous pouvez défausser 1 carte ""Abysses Ardents"", puis ciblez 1 carte contrôlée par votre adversaire ou dans son Cimetière ; mélangez-la dans le Deck. Si cette carte sur le Terrain est détruite au combat ou par un effet de carte, et envoyée au Cimetière : vous pouvez piocher 1 carte. Vous ne pouvez utiliser cet effet de ""Virgile, Star du Rock des Abysses Ardents"" qu'une fois par tour.",Supports archetypes /Burning Abyss,,Discards for cost/Returns from your opponent's field to your opponent's Deck/Returns from your opponent's Graveyard to your opponent's Deck/Activates from your Graveyard/You draw cards,Unclassified/Ignition/Trigger/Condition,
36006208,Lac de Feu des Abysses Ardents,Unlimited(OCG)/Unlimited(TCG),PIÈGE,,,,,,,,,,,,"Envoyez 2 monstres ""Abysses Ardents"" face recto que vous contrôlez au Cimetière, puis ciblez max. 3 cartes sur le Terrain ; détruisez les cibles.",Supports archetypes /Burning Abyss,,Sends from field to Graveyard for cost,Cost/Effect,
35884610,Maillot U.A.,Unlimited(OCG)/Unlimited(TCG),MAGIE,,,,,,,,,,,,"Équipable uniquement à un monstre ""U.A."". Il gagne 1000 ATK/DEF, et aussi, s'il combat un monstre de votre adversaire, tous les dommages de combat qu'il inflige à votre adversaire sont doublés. Si le monstre équipé détruit un monstre avec son attaque : durant cette Battle Phase, il peut attaquer une seconde fois. Durant votre Standby Phase : bannissez le monstre équipé. Si cette carte est envoyée au Cimetière parce que le monstre équipé est renvoyé à la main : vous pouvez renvoyer cette carte à la main.",Supports archetypes /U.A.,,Activates from your Graveyard/Returns itself from Graveyard to hand,Condition/Continuous-like/Trigger-like,
11705261,Tactiques de Changement Xyz,Unlimited(OCG)/Unlimited(TCG),MAGIE,,,,,,,,,,,,"Lorsqu'un monstre ""Utopie"" est Invoqué par Xyz sur votre Terrain : vous pouvez payer 500 LP ; piochez 1 carte. Vous ne pouvez contrôler qu'1 ""Tactiques de Changement Xyz"".",Supports archetypes /Utopia ,,Activates upon Xyz Summon/You draw cards,Trigger-like/Unclassified,
51543904,Numéro 99 : Dragon Utopique,Unlimited(OCG)/Unlimited(TCG),LUMIÈRE,[Dragon/Xyz／Effet],,,Rang 10,,,4000,2000,,3 monstres de Niveau 10,,"Vous pouvez aussi Invoquer par Xyz cette carte en défaussant 1 Carte Magie ""Magie-Rang-Plus"" et en utilisant un monstre ""Utopie"" que vous contrôlez comme le Matériel Xyz. (Les Matériels Xyz attachés au monstre deviennent aussi des Matériels Xyz de cette carte.) Une fois par tour : vous pouvez cibler 1 monstre ""Numéro"" dans votre Cimetière ; Invoquez-le Spécialement en Position de Défense, mais ses effets sont annulés. Durant le tour de chaque joueur, lorsqu'un effet de monstre qui cible cette carte face recto est activé : vous pouvez détacher 1 Matériel Xyz de cette carte ; annulez l'activation, et si vous le faites, détruisez la carte.",Supports archetypes /Rank-Up-Magic/Utopia /Number,,Discards for cost/Transfers,Summon/Ignition/Quick,
