Passcode,Name,Status,Attribute,type,link,link_arrows,rank,pendulum_scale,level,attack,defense,spell_attribute,summoning_condition,pendulum_condition,card_text,card_supports,card_anti_supports,card_actions,effect_types,
86605184,Gardien Pare-Feu,Unlimited(OCG)/Unlimited(TCG),TÉNÈBRES,[Cyberse/Effet],,,,,Niveau 4,100,2000,,,,"Si cette carte est envoyée au Cimetière comme Matériel pour l'Invocation Lien d'un monstre Cyberse : vous pouvez Invoquer Spécialement cette carte, mais bannissez-la lorsqu'elle quitte le Terrain. Lorsqu'une attaque impliquant votre Monstre Lien et un Monstre Lien de l'adversaire est déclarée : vous pouvez bannir cette carte depuis votre Cimetière ; annulez l'attaque, et si vous le faites, jusqu'à la fin de ce tour, l'ATK d'origine du monstre de l'adversaire devient 0, et aussi, il n'est pas affecté par d'autres effets de carte (ses propres effets exclus). Vous ne pouvez utiliser chaque effet de ""Gardien Pare-Feu"" qu'une fois par tour.",Cyberse/Link Monster,Link Monster,Activates from your Graveyard/Activates if used as Link Material/Activates upon attack declaration,Trigger/Ignition/Condition,
76589546,Dragon du Dépassement,Unlimited(OCG)/Unlimited(TCG),TÉNÈBRES,[Dragon/Effet],,,,,Niveau 1,0,0,,,,"Lorsqu'un ou plusieurs monstres sur le Terrain sont détruits par un effet de carte (sauf durant la Damage Step) : vous pouvez Invoquer Spécialement cette carte depuis votre main, puis, si min. 2 monstres sur le Terrain ont été détruits par l'effet de carte, vous pouvez Invoquer Spécialement 1 ""Jeton du Dépassement"" (Dragon/TÉNÈBRES/Niveau 1/ATK 0/DEF 0). Vous ne pouvez utiliser cet effet de ""Dragon du Dépassement"" qu'une fois par tour.",,,Activates if destroyed by card effect/Activates from your hand,Trigger/Condition,
75366958,Dinolutteur Coelasilat,Unlimited(OCG)/Unlimited(TCG),TERRE,[Dinosaure/Syntoniseur／Effet],,,,,Niveau 2,100,800,,,,"Si vous ne contrôlez aucun monstre, vous pouvez Invoquer Spécialement cette carte (depuis votre main). Si elle est Invoquée de cette façon, cette carte ne peut pas être utilisée comme Matériel Lien, sauf pour l'Invocation Lien d'un monstre ""Dinolutteur"". Vous ne pouvez Invoquer Spécialement ""Dinolutteur Coelasilat"" qu'une fois par Duel de cette façon.",Supports archetypes /Dinowrestler,,Activates from your hand,Summon/Condition,
11755663,Dinolutteur Martial Anga,Unlimited(OCG)/Unlimited(TCG),TERRE,[Dinosaure/Effet],,,,,Niveau 5,1600,0,,,,"Durant le calcul des dommages, lorsque votre monstre ""Dinolutteur"" combat un monstre avec une ATK supérieure ou égale (Effet Rapide) : vous pouvez envoyer cette carte depuis votre main au Cimetière ; votre monstre combattant ne peut pas être détruit par ce combat, et aussi, terminez la Battle Phase après la Damage Step. Une fois par tour, durant la End Phase, si cette carte est dans le Cimetière parce qu'elle y a été envoyée pour activer cet effet ce tour, et que votre adversaire contrôle plus de monstres que vous : vous pouvez Invoquer Spécialement cette carte.",Supports archetypes /Dinowrestler,,Sends itself from hand to Graveyard for cost/Ends the Battle Phase,Quick/Trigger,
48150362,Piochemain - HÉROS de la Destinée,Unlimited(OCG)/Unlimited(TCG),TÉNÈBRES,[Guerrier/Effet],,,,,Niveau 4,1600,800,,,,"Si cette carte est Invoquée Spécialement par l'effet d'un monstre ""HÉROS"" : vous pouvez faire piocher 1 carte à chaque joueur. Durant la prochaine Standby Phase après que cette carte a été envoyée au Cimetière : vous pouvez Invoquer Spécialement cette carte depuis votre Cimetière, mais bannissez-la lorsqu'elle quitte le Terrain. Vous ne pouvez utiliser chaque effet de ""Piochemain - HÉROS de la Destinée"" qu'une fois par tour.",Supports archetypes /HERO,,Activates upon Special Summon/You draw cards/Your opponent draws cards/Activates from your Graveyard,Trigger/Condition,
73422829,Force White Super Quantum,Unlimited(OCG)/Unlimited(TCG),LUMIÈRE,[Elfe/Effet],,,,,Niveau 7,2400,2400,,,,"Vous pouvez envoyer 1 monstre non-LUMIÈRE ""Super Quant"" depuis votre main ou Terrain face recto au Cimetière ; Invoquez Spécialement cette carte depuis votre main en Position de Défense. Lorsque cette carte est Invoquée Normalement ou Spécialement : vous pouvez envoyer 1 monstre ""Super Quant"" depuis votre Deck au Cimetière, et si vous le faites, l'Attribut et Niveau de cette carte deviennent les mêmes que ceux du monstre. Si cette carte est envoyée au Cimetière : vous pouvez ajouter 1 ""Fée Alphan Super Quantique"" depuis votre Deck ou Cimetière à votre main. Vous ne pouvez utiliser chaque effet de ""Force White Super Quantum"" qu'une fois par tour.",Supports archetypes /Super Quant,,Activates from your hand/Adds from Deck to hand/Activates upon Normal Summon/Activates upon Special Summon/Activates from your Graveyard/Sends from hand to Graveyard for cost/Sends from field to Graveyard for cost/Sends from your Deck to your Graveyard,Ignition/Trigger/Condition,
09794980,"Idlee l'Incarnation, Chevalier du Cauchemar",Unlimited(OCG)/Unlimited(TCG),TÉNÈBRES,[Elfe/Effet],,,,,Niveau 9,2100,2100,,,,"Les monstres de Niveau 9 que vous contrôlez ne peuvent pas être détruits par des effets de carte. Vous ne pouvez utiliser chacun des effets suivants de ""Idlee l'Incarnation, Chevalier du Cauchemar"" qu'une fois par tour.●Si la somme des Classifications Lien des monstres sur le Terrain est min. 8 (Effet Rapide) : vous pouvez Invoquer Spécialement cette carte depuis votre main.●Si cette carte est Invoquée Spécialement, tant que votre adversaire contrôle plus de Monstres Lien que vous : vous pouvez envoyer tous les Monstres Lien sur le Terrain au Cimetière.",Link Monster,Link Monster,Activates from your hand/Activates upon Special Summon,Continuous/Condition/Quick/Trigger,
35183584,Mardark de la Dragarde de l'Héritage du Monde,Unlimited(OCG)/Unlimited(TCG),VENT,[Dragon/Effet],,,,,Niveau 9,2600,3000,,,,"Tous les monstres contrôlés par votre adversaire perdent 500 ATK/DEF pour chaque monstre Dragon que vous contrôlez. Vous ne pouvez utiliser chacun des effets suivants de ""Mardark de la Dragarde de l'Héritage du Monde"" qu'une fois par tour.●Vous pouvez bannir 2 Monstres Normaux depuis votre main ou Cimetière ; Invoquez Spécialement cette carte depuis votre main.●Si cette carte sur le Terrain est détruite au combat ou par un effet de carte : vous pouvez ajouter 1 monstre de Niveau 9 de Type et Attribut d'origine différents de cette carte depuis votre Cimetière à votre main.",Dragon/Normal Monster,,Activates from your hand/Activates if destroyed by battle/Activates if destroyed by card effect/Adds from Graveyard to hand,Continuous/Condition/Ignition/Trigger,
34966096,Traître du Chaos,Unlimited(OCG)/Unlimited(TCG),TÉNÈBRES,[Démon/Effet],,,,,Niveau 6,2000,2000,,,,"Si cette carte est dans votre Cimetière : vous pouvez bannir 1 monstre LUMIÈRE et 1 monstre TÉNÈBRES (""Traître du Chaos"" exclu) depuis votre Cimetière ; Invoquez Spécialement cette carte en Position de Défense, mais bannissez-la lorsqu'elle quitte le Terrain. Si cette carte est Invoquée Spécialement : vous pouvez cibler 1 carte dans le Cimetière de votre adversaire ; bannissez-la. Vous ne pouvez utiliser chaque effet de ""Traître du Chaos"" qu'une fois par tour.",LIGHT/DARK,,Activates from your Graveyard/Activates upon Special Summon,Ignition/Trigger/Condition,
61465001,Nuage Bruyant le Serpent Tempête,Unlimited(OCG)/Unlimited(TCG)/Unlimited(TCGSpeed Duel),EAU,[Reptile/Effet],,,,,Niveau 5,0,2000,,,,"Ni Invocable Normalement ni Posable Normalement. Doit d'abord être Invoquée Spécialement (depuis votre main) en bannissant 1 monstre FEU et 1 monstre VENT depuis votre Cimetière. Vous ne pouvez utiliser chacun des effets suivants de ""Nuage Bruyant le Serpent Tempête"" qu'une fois par tour.●Vous pouvez bannir 1 monstre FEU depuis votre Cimetière, puis ciblez 1 monstre contrôlé par votre adversaire ; détruisez le monstre, et si vous le faites, cette carte gagne une ATK égale à l'ATK d'origine du monstre détruit.●Vous pouvez bannir 1 monstre VENT depuis votre Cimetière, puis ciblez 1 carte dans la Zone Magie & Piège de votre adversaire ; détruisez-la.",FIRE/WIND,,,Summon/Condition/Ignition,
96915510,"Créaltar, l'Initiateur de la Lutincantation",Unlimited(OCG)/Unlimited(TCG),LUMIÈRE,[Démon/Rituel／Effet],,,,,Niveau 10,3000,3000,,,,"Vous pouvez Invoquer Rituellement cette carte avec ""Commencement de Lutincantation"". Durant la Main Phase (Effet Rapide) : vous pouvez révéler cette carte dans votre main ; défaussez 1 carte, puis Invoquez Spécialement un nombre de monstres ""Lutincantation"" depuis votre Cimetière dont le Niveau total est égal à 10, mais mélangez-les dans le Deck durant la End Phase. Vous ne pouvez utiliser cet effet de ""Créaltar, l'Initiateur de la Lutincantation"" qu'une fois par tour. Les monstres non-Rituel ""Lutincantation"" que vous contrôlez gagnent 2000 ATK, mais leurs effets sont annulés.",Supports archetypes /Impcantation,,Activates from your hand/Discards for effect/Returns from your field to your Deck/Reveals itself in the hand for cost,Summon/Quick/Condition/Continuous,
22900219,Dinolutteur Chimère T Rexlutte,Unlimited(OCG)/Unlimited(TCG),TERRE,[Dinosaure/Fusion／Effet],,,,,Niveau 8,3500,0,,"1 Monstre Lien ""Dinolutteur"" + 1 monstre ""Dinolutteur""",,"Si cette carte combat, votre adversaire ne peut pas activer de Cartes Magie/Piège jusqu'à la fin de la Damage Step. Si cette carte attaque un monstre en Position de Défense, infligez des dommages de combat perçants. Les monstres de votre adversaire ne peuvent pas cibler de monstres (celui-ci exclu) avec une attaque. Si cette carte détruit un monstre au combat : elle gagne 500 ATK. Si cette carte est détruite par un effet de carte : détruisez tous les monstres en Position d'Attaque de votre adversaire.",Supports archetypes /Dinowrestler,,Activates when it destroys a monster by battle/Activates if destroyed by card effect,Continuous/Trigger,
69394324,Dominance - HÉROS de la Destinée,Unlimited(OCG)/Unlimited(TCG),TÉNÈBRES,[Guerrier/Fusion／Effet],,,,,Niveau 10,2900,2600,,"3 monstres ""HÉROS de la Destinée""",,"Durant votre Main Phase : vous pouvez regarder les 5 cartes du dessus de votre Deck ou du Deck de votre adversaire, puis placez-les au-dessus du Deck dans l'ordre de votre choix. Lorsque cette carte détruit un monstre de l'adversaire au combat : vous pouvez piocher 1 carte. Si cette carte Invoquée par Fusion est détruite au combat ou par un effet de carte : vous pouvez cibler 3 monstres ""HÉROS de la Destinée"" de max. Niveau 9 de noms différents dans votre Cimetière ; Invoquez-les Spécialement. Vous ne pouvez utiliser chaque effet de ""Dominance - HÉROS de la Destinée"" qu'une fois par tour.",Supports archetypes /Destiny HERO,,Looks at cards from the top of your Deck/Changes your Deck order/Places cards from your Deck on the top of the Deck/Looks at cards from the top of the opponent's Deck/Changes your opponent's Deck order/Places cards from the opponent's Deck on the top of the Deck/Activates when it destroys a monster by battle/You draw cards/Activates if destroyed by battle/Activates if destroyed by card effect,Ignition/Trigger/Condition,
95793022,Almarduke de la Dragarde du Calice du Monde,Unlimited(OCG)/Unlimited(TCG),VENT,[Dragon/Fusion／Effet],,,,,Niveau 9,3000,2600,,3 Monstres Lien,,"Doit d'abord être Invoquée par Fusion, ou Spécialement depuis votre Extra Deck en Sacrifiant les cartes ci-dessus que vous contrôlez (auquel cas vous n'utilisez pas ""Polymérisation""). Cette carte peut attaquer une fois tous les monstres contrôlés par votre adversaire. Lorsqu'une attaque impliquant cette carte et un Monstre Lien de l'adversaire est déclarée : vous pouvez bannir 1 Monstre Lien avec la même Classification Lien que le monstre depuis votre Terrain ou Cimetière ; détruisez le monstre de l'adversaire, et si vous le faites, infligez des dommages à votre adversaire égaux à son ATK d'origine.",Link Monster,Link Monster,Tributes Fusion Materials for Contact Fusion/Activates upon attack declaration,Summon/Continuous/Trigger,
58672736,Dinolutteur Giga Spinosavate,Unlimited(OCG)/Unlimited(TCG),TERRE,[Dinosaure/Synchro／Effet],,,,,Niveau 8,3000,0,,1 Syntoniseur Dinosaure + 1+ monstre non-Syntoniseur,,"Si cette carte combat, votre adversaire ne peut pas activer de Cartes Magie/Piège jusqu'à la fin de la Damage Step. Les monstres de votre adversaire ne peuvent pas cibler de monstres (celui-ci exclu) avec une attaque. Une fois par tour : vous pouvez cibler 1 monstre contrôlé par votre adversaire ; détruisez-le. Si cette carte va être détruite au combat ou par un effet de carte, vous pouvez détruire 1 carte que vous contrôlez à la place.",Dinosaur,,,Continuous/Ignition,
94677445,Ib la Justicière du Calice du Monde,Unlimited(OCG)/Unlimited(TCG),EAU,[Magicien/Synchro／Syntoniseur／Effet],,,,,Niveau 5,1800,2100,,1 Syntoniseur + 1+ monstre non-Syntoniseur,,"Pour l'Invocation Synchro de cette carte, vous pouvez traiter 1 Monstre Normal ""Calice du Monde"" que vous contrôlez comme Syntoniseur. Vous ne pouvez utiliser chacun des effets suivants de ""Ib la Justicière du Calice du Monde"" qu'une fois par tour.●Si cette carte est Invoquée par Synchronisation : vous pouvez ajouter 1 carte ""Héritage du Monde"" depuis votre Deck à votre main.●Si cette carte Invoquée par Synchronisation est envoyée depuis le Terrain au Cimetière : vous pouvez Invoquer Spécialement 1 monstre ""Calice du Monde"" (""Ib la Justicière du Calice du Monde"" exclu) depuis votre Deck ou Cimetière.",Supports archetypes /World Chalice/World Legacy,,Activates upon Synchro Summon/Adds from Deck to hand/Activates from your Graveyard,Condition/Trigger,
21065189,Dragon eXceed Pare-Feu,Unlimited(OCG)/Unlimited(TCG),TÉNÈBRES,[Cyberse/Xyz／Effet],,,Rang 4,,,2500,2000,,2+ monstres de Niveau 4,,"Cette carte Invoquée par Xyz gagne 500 ATK x la somme des Classifications Lien des Monstres Lien liés à cette carte. Vous pouvez détacher 2 Matériels de cette carte, puis ciblez 1 Monstre Lien Cyberse Link-4 dans votre Cimetière ; Invoquez-le Spécialement sur votre Terrain afin qu'il pointe cette carte, et aussi, vous ne pouvez ni Invoquer Spécialement d'autres monstres ni attaquer directement le reste de ce tour.",Link Monster/Cyberse,,Detaches multiple Xyz Materials as cost,Continuous/Ignition,
93854893,"Dingirsu, l'Orcust de l'Étoile du Berger",Unlimited(OCG)/Unlimited(TCG),TÉNÈBRES,[Machine/Xyz／Effet],,,Rang 8,,,2600,2100,,2 monstres de Niveau 8,,"Vous ne pouvez Invoquer Spécialement un ou plusieurs ""Dingirsu, l'Orcust de l'Étoile du Berger"" qu'une fois par tour. Vous pouvez aussi Invoquer par Xyz cette carte en utilisant un Monstre Lien ""Orcust"" que vous contrôlez comme Matériel. Si une ou plusieurs cartes que vous contrôlez vont être détruites au combat ou par un effet de carte, vous pouvez détacher 1 Matériel de cette carte à la place. Si cette carte est Invoquée Spécialement : vous pouvez activer 1 de ces effets ;●Envoyez 1 carte contrôlée par votre adversaire au Cimetière.●Attachez 1 de vos monstres Machine bannis à cette carte comme Matériel.",Supports archetypes /Orcust,,Activates upon Special Summon/Sends from your opponent's field to your opponent's Graveyard/Does not have effects which detach Xyz Materials for cost/Attaches your banished cards as Xyz Material,Summon/Continuous/Trigger,
69121954,Dinolutteur Terra Parkourio,Unlimited(OCG)/Unlimited(TCG),TERRE,[Dinosaure/Lien／Effet],Lien 2,Top/Left,,,,1000,-,,,,"2 monstres ""Dinolutteur""Si vous activez ""Dino Lutte Mondiale"" : vous pouvez cibler 1 monstre ""Dinolutteur"" dans votre Cimetière ; ajoutez-le à votre main. Si cette carte est envoyée au Cimetière comme Matériel Lien : vous pouvez cibler 1 monstre ""Dinolutteur"" dans votre Cimetière ; Invoquez-le Spécialement en Position de Défense, mais annulez ses effets, et aussi, vous ne pouvez pas Invoquer Spécialement de monstres (monstres ""Dinolutteur"" exclus) le reste de ce tour. Vous ne pouvez utiliser chaque effet de ""Dinolutteur Terra Parkourio"" qu'une fois par tour.",Supports archetypes /Dinowrestler,,Adds from Graveyard to hand/Activates from your Graveyard/Activates if used as Link Material,Trigger,
95515058,Gouki L'Ogre Lame,Unlimited(OCG)/Unlimited(TCG),TERRE,[Guerrier/Lien／Effet],Lien 3,Top/Bottom-Left/Bottom,,,,2400,-,,,,"2+ monstres ""Gouki""Gagne 300 ATK pour chaque monstre pointé par cette carte. Une fois par tour : vous pouvez Sacrifier 1 monstre pointé par cette carte sur le Terrain ; durant chaque Battle Phase ce tour, cette carte peut faire une seconde attaque.",Supports archetypes /Gouki,,Tributes for cost/Tributes opponent's monsters,Continuous/Ignition,
22510667,Gouki L'Ogre Solide,Unlimited(OCG)/Unlimited(TCG),TERRE,[Guerrier/Lien／Effet],Lien 3,Top/Left/Bottom,,,,2400,-,,,,"2+ monstres ""Gouki""Non destructible ni au combat ni par des effets de carte tant qu'elle pointe un monstre ""Gouki"". Une fois par tour (Effet Rapide) : vous pouvez cibler 1 monstre ""Gouki"" (""Gouki L'Ogre Solide"" exclu) dans votre Zone Monstre Main ; déplacez le monstre que vous contrôlez dans votre Zone Monstre Main pointée par cette carte.",Supports archetypes /Gouki,,,Continuous/Quick,
95493471,Magna Exploseur Roi Méca Super Quantique Néo,Unlimited(OCG)/Unlimited(TCG),LUMIÈRE,[Machine/Lien／Effet],Lien 3,Bottom-Left/Bottom/Bottom-Right,,,,2500,-,,,,"2+ Monstres à Effet (un monstre ""Super Quant"" inclus)Cette carte Invoquée par Lien ne peut pas être détruite par des effets de carte de votre adversaire. Chaque fois qu'un ou plusieurs Monstres Xyz ""Super Quant"" de nom différent des cartes que vous contrôlez sont Invoqués Spécialement depuis l'Extra Deck dans des zones pointées par cette carte : piochez 1 carte. Si un ou plusieurs Monstres Xyz face recto pointés par cette carte sont détruits au combat ou par un effet de carte de l'adversaire : vous pouvez Invoquer Spécialement 1 monstre ""Super Quant"" depuis votre Deck du même Attribut d'origine qu'1 de ces Monstres Xyz détruits. Vous ne pouvez utiliser cet effet de ""Magna Exploseur Roi Méca Super Quantique Néo"" qu'une fois par tour.",Supports archetypes /Super Quant,,Activates upon Special Summon/You draw cards/Activates if destroyed by battle/Activates if destroyed by card effect,Continuous/Trigger/Condition,
57282724,Démiurge Théurgéquipe des Équipements du Monde,Unlimited(OCG)/Unlimited(TCG),TÉNÈBRES,[Cyberse/Lien／Effet],Lien 3,Left/Bottom/Right,,,,3500,-,,,,"3 monstres de min. Niveau 5Non utilisable comme Matériel Lien. Cette carte Invoquée par Lien n'est pas affectée par les effets d'autres monstres. Vous ne pouvez utiliser chacun des effets suivants de ""Démiurge Théurgéquipe des Équipements du Monde"" qu'une fois par tour.●Durant votre Main Phase, si vous contrôlez cette carte qui a été Invoquée par Lien en utilisant 3 monstres qui avaient 3 Types et Attributs différents sur le Terrain : vous pouvez détruire toutes les autres cartes sur le Terrain.●Si votre adversaire Invoque Spécialement un ou plusieurs monstres depuis l'Extra Deck (sauf durant la Damage Step) : vous pouvez Invoquer Spécialement 1 monstre ""Héritage du Monde"" depuis votre Deck.",Supports archetypes /World Legacy,,,Condition/Continuous/Ignition/Trigger,
84271823,"Puzzlomino, le Glisse-Effaceur",Unlimited(OCG)/Unlimited(TCG),LUMIÈRE,[Magicien/Lien／Effet],Lien 2,Bottom/Right,,,,1300,-,,,,"2 monstres de Niveaux différentsSi un monstre est Invoqué Spécialement face recto dans une zone pointée par cette carte tant que vous contrôlez ce monstre (sauf durant la Damage Step) : vous pouvez déclarer un Niveau de 1 à 8 ; jusqu'à la fin du tour, le monstre devient de ce Niveau. Vous pouvez cibler 2 monstres de même Niveau (1 sur chaque Terrain) ; détruisez-les. Vous ne pouvez utiliser chaque effet de ""Puzzlomino, le Glisse-Effaceur"" qu'une fois par tour.",,,,Trigger/Ignition/Condition,
20665527,Véhicolonne Amphibie Ambuleine,Unlimited(OCG)/Unlimited(TCG),FEU,[Machine/Lien／Effet],Lien 4,Left/Bottom/Bottom-Right/Right,,,,2600,-,,,,"2+ Monstres à EffetGagne 200 ATK pour chaque Monstre Lien dans les Cimetières. Vous ne pouvez utiliser chacun des effets suivants de ""Véhicolonne Amphibie Ambuleine"" qu'une fois par tour.●Si cette carte est détruite : vous pouvez cibler 1 monstre de max. Link-3 dans l'un des Cimetières ; Invoquez-le Spécialement.●Si un ou plusieurs monstres de max. Link-3 sur le Terrain sont détruits au combat ou par un effet de carte tant que cette carte est dans votre Cimetière : vous pouvez bannir cette carte depuis votre Cimetière ; détruisez 1 carte sur le Terrain.",Effect Monster/Link Monster,Link Monster,Activates if destroyed by battle/Activates if destroyed by card effect/Activates from your Graveyard,Continuous/Condition/Trigger,
14604710,Monstruosité de l'Héritage du Monde,Unlimited(OCG)/Unlimited(TCG),MAGIE,,,,,,,,,,,,"Activez 1 de ces effets.●Invoquez Spécialement 1 monstre de Niveau 9 depuis votre main.●Ciblez 1 monstre de Niveau 9 que vous contrôlez ; Invoquez Spécialement 2 monstres de Niveau 9 avec chacun un Type et Attribut d'origine différents du monstre face recto ciblé, et de noms différents les uns des autres, depuis votre Deck, mais ces 2 monstres ne peuvent pas attaquer, et aussi, détruisez-les durant la End Phase.Vous ne pouvez activer qu'1 ""Monstruosité de l'Héritage du Monde"" par tour.",,,,Effect/Condition,
13482262,Thanatose de Lutincantation,Unlimited(OCG)/Unlimited(TCG),MAGIE,,,,,,,,,,,,"Lorsque cette carte est activée : vous pouvez révéler 1 monstre ""Lutincantation"" dans votre main et Invoquer Spécialement 2 monstres du nom du monstre depuis votre Deck, puis mélangez le monstre révélé dans le Deck. Une fois par tour, si un Monstre Rituel est Invoqué Spécialement sur votre Terrain : vous pouvez cibler 1 carte sur le Terrain (sauf durant la Damage Step) ; détruisez-la. Vous ne pouvez activer qu'1 ""Thanatose de Lutincantation"" par tour.",Supports archetypes /Impcantation,,Reveals your hand for effect/Returns from your hand to your Deck/Activates upon Special Summon,Effect/Trigger-like/Condition,
40971261,Hymne Funèbre du Dragon Perdu,Unlimited(OCG)/Unlimited(TCG),MAGIE,,,,,,,,,,,,"Activez cette carte en déclarant 1 nom de carte. Chaque fois que la carte déclarée ou son effet est activé, divisez par deux les LP de son propriétaire immédiatement après sa résolution. Durant la End Phase, si cette carte a divisé par deux les LP d'un joueur ce tour, envoyez cette carte au Cimetière. Tant que votre adversaire contrôle un monstre, cette carte ne peut pas être détruite par des effets de carte.",,,Declares a card name/Sends itself from field to Graveyard,Activation requirement/Continuous-like,
76375976,Mine Mystique,Forbidden(OCG)/Forbidden(TCG),MAGIE,,,,,,,,,,,,"Si votre adversaire contrôle plus de monstres que vous, votre adversaire ne peut ni activer d'effets de monstre ni déclarer d'attaque. Si vous contrôlez plus de monstres que votre adversaire, vous ne pouvez ni activer d'effets de monstre ni déclarer d'attaque. Une fois par tour, durant la End Phase, si chaque joueur contrôle le même nombre de monstres : détruisez cette carte.",,,,Continuous-like/Trigger-like,
49154689,Doublure,Unlimited(OCG)/Unlimited(TCG),MAGIE,,,,,,,,,,,,"Sacrifiez 1 monstre, puis ciblez 1 monstre dans le Cimetière de votre adversaire du même Type et Attribut d'origine ; Invoquez-le Spécialement sur votre Terrain. Vous ne pouvez activer qu'1 ""Doublure"" par tour.",,,Tributes for cost,Cost/Effect/Condition,
75153328,Permutation de Paquet,Unlimited(OCG)/Unlimited(TCG),MAGIE,,,,,,,,,,,,"Ciblez 1 Monstre non-Lien face recto que vous contrôlez et 1 Monstre Lien contrôlé par votre adversaire ; échangez le contrôle de ces monstres. Vous ne pouvez activer qu'1 ""Permutation de Paquet"" par tour.",,Link Monster,Changes control,Effect/Condition,
48032131,Tactiques D,Unlimited(OCG)/Unlimited(TCG),PIÈGE,,,,,,,,,,,,"Durant la Standby Phase : vous pouvez faire gagner 400 ATK à tous les monstres ""HÉROS"" que vous contrôlez (même si cette carte quitte le Terrain). Si ""Soldat Dragon de l'Ultime Destinée"" ou un ou plusieurs monstres ""HÉROS de la Destinée"" de min. Niveau 8 sont Invoqués Spécialement sur votre Terrain (sauf durant la Damage Step) : vous pouvez bannir 1 carte depuis la main (au hasard), Terrain ou Cimetière de votre adversaire. Si cette carte dans la Zone Magie & Piège est détruite par un effet de carte : vous pouvez ajouter 1 monstre ""HÉROS de la Destinée"" depuis votre Deck à votre main. Vous ne pouvez utiliser chaque effet de ""Tactiques D"" qu'une fois par tour.",Supports archetypes /Destiny HERO/HERO,,Activates from your Graveyard/Adds from Deck to hand,Trigger-like,
47810543,Magie de Mousquet - Couronne Malhonnête,Unlimited(OCG)/Unlimited(TCG),PIÈGE,,,,,,,,,,,,"Vous ne pouvez contrôler qu'1 ""Magie de Mousquet - Couronne Malhonnête"". Durant la Main Phase : vous pouvez Invoquer Spécialement 1 monstre ""Magie de Mousquet"" depuis votre main, et si vous le faites, si la Zone Monstre Main de votre adversaire dans la colonne actuelle du monstre est inutilisée, la zone ne peut pas être utilisée jusqu'à la fin de ce tour (même si cette carte quitte le Terrain). Vous ne pouvez utiliser cet effet de ""Magie de Mousquet - Couronne Malhonnête"" qu'une fois par tour.",Supports archetypes /Magical Musket,,,Unclassified/Quick-like/Condition,
