Passcode,Name,Status,Attribute,type,link,link_arrows,rank,pendulum_scale,level,attack,defense,spell_attribute,summoning_condition,pendulum_condition,card_text,card_supports,card_anti_supports,card_actions,effect_types,
74218258,Peinture Arc-en-Ciel Météorologique,Unlimited(OCG)/Unlimited(TCG),PIÈGE,,,,,,,,,,,,"Vous ne pouvez contrôler qu'1 ""Peinture Arc-en-Ciel Météorologique"". Les Monstres à Effet ""Météorologique"" dans vos Zones Monstre Main de la colonne de cette carte et de ses colonnes adjacentes gagnent cet effet.●Si votre adversaire contrôle un monstre (Effet Rapide) : vous pouvez bannir cette carte ; Invoquez Spécialement 1 monstre ""Météorologique"" de nom différent depuis votre Deck, et aussi, vous ne pouvez pas Invoquer Spécialement d'autres monstres depuis le Deck le reste de ce tour.",Supports archetypes /The Weather,,Grants effect to other cards,Unclassified/Continuous-like/Quick-like,
36197902,Effondrement de l'Héritage du Monde,Unlimited(OCG)/Unlimited(TCG),PIÈGE,,,,,,,,,,,,"Vous pouvez bannir 1 monstre ""Héritage du Monde"" depuis votre main, Cimetière ou Terrain face recto, puis ciblez 1 Monstre Lien sur le Terrain ; il gagne une ATK égale à l'ATK d'origine du monstre banni (même si cette carte quitte le Terrain). Si un ou plusieurs Monstres Lien que vous contrôlez sont détruits au combat ou par un effet de carte de l'adversaire tant que cette carte est dans votre Cimetière : vous pouvez bannir cette carte ; Invoquez Spécialement 1 Monstre Lien Cyberse depuis votre Cimetière. Vous ne pouvez utiliser chaque effet de ""Effondrement de l'Héritage du Monde"" qu'une fois par tour.",Supports archetypes /World Legacy,,,Quick-like/Trigger-like/Condition,
73192600,Cliffhanger de l'Héritage du Monde,Unlimited(OCG)/Unlimited(TCG),PIÈGE,,,,,,,,,,,,"Lorsqu'une attaque impliquant 2 Monstres Lien est déclarée : mélangez tous les monstres sur le Terrain et dans les Cimetières dans les Decks. Le reste de ce tour après la résolution de cette carte, aucun joueur ne peut Invoquer par Lien.",Link Monster,Link Monster,Returns from your field to your Deck/Returns from your opponent's field to your opponent's Deck/Returns from your Graveyard to your Deck/Returns from your opponent's Graveyard to your opponent's Deck/Activates upon attack declaration,Activation requirement/Effect,
09581215,Trappe de Chaîne,Unlimited(OCG)/Unlimited(TCG),PIÈGE,,,,,,,,,,,,"Lorsque votre adversaire active un effet de monstre en réponse à l'activation d'une carte ou d'un effet : annulez l'effet de l'adversaire, puis, votre adversaire peut bannir 1 carte depuis sa main ou Deck du même nom d'origine que la carte annulée. S'il ne l'a pas fait, vous pouvez bannir 1 carte au hasard depuis sa main.",,,,Activation requirement/Effect,
62370023,Effet de Bonhomme de Neige,Unlimited(OCG)/Unlimited(TCG),PIÈGE,,,,,,,,,,,,"Ciblez 1 monstre face recto que vous contrôlez ; jusqu'à la fin de ce tour, il gagne une ATK égale à la somme des ATK d'origine des autres monstres que vous contrôlez. Il ne peut pas attaquer directement durant le tour où vous activez cette carte. Vous ne pouvez activer qu'1 ""Effet de Bonhomme de Neige"" par tour.",,,,Effect/Condition,
08868767,Dégime,Unlimited(OCG)/Unlimited(TCG),PIÈGE,,,,,,,,,,,,"Lancez un dé à six faces. Appliquez cet effet selon le tour.●Durant votre tour : bannissez un nombre de cartes depuis votre Cimetière égal au résultat. Puis, si le résultat est 1, envoyez aussi 6 cartes du dessus de votre Deck au Cimetière.●Durant le tour de votre adversaire : envoyez un nombre de cartes du dessus de votre Deck au Cimetière égal au résultat. Puis, si le résultat est 6, bannissez aussi 1 carte depuis votre Cimetière.",,,Sends from the top of your Deck to your Graveyard,Effect,
11434258,Chaînes de Saryuja,Unlimited(OCG)/Unlimited(TCG),PIÈGE,,,,,,,,,,,,"Ciblez 1 Monstre Lien contrôlé par votre adversaire ou dans son Cimetière ; piochez un nombre de cartes égal à sa Classification Lien, puis, si vous avez min. 2 cartes dans votre main, placez 2 cartes depuis votre main au-dessous de votre Deck dans l'ordre de votre choix. Vous ne pouvez activer qu'1 ""Chaînes de Saryuja"" par tour.",,Link Monster,You draw cards/Places cards from the player's hand on the bottom of the Deck,Effect/Condition,
83928661,Danger ! Pieds de Force !,Unlimited(OCG)/Unlimited(TCG),MAGIE,,,,,,,,,,,,"Équipable uniquement à un monstre ""Danger !"". Il gagne 800 ATK/DEF. Il ne peut pas être détruit par des effets de carte. Il peut faire max. 2 attaques sur des monstres durant chaque Battle Phase.",Supports archetypes /Danger!,,,Condition/Continuous-like,
90126061,Numéro 5 : Dragon Chimère de la Mort,Unlimited(OCG)/Unlimited(TCG),TÉNÈBRES,[Dragon/Xyz／Effet],,,Rang 5,,,0,0,,2+ monstres de Niveau 5,,"Gagne 1000 ATK pour chaque Matériel qui lui est attaché. Cette carte avec du Matériel peut attaquer une fois tous les monstres contrôlés par votre adversaire. À la fin de la Battle Phase, si cette carte a combattu : vous pouvez activer un des effets suivants.●Ciblez 1 monstre dans votre Cimetière ; attachez-lui cette carte comme Matériel.●Ciblez 1 carte dans le Cimetière de votre adversaire ; placez-la au-dessus de son Deck.",,,Attaches from your Graveyard as Xyz Material/Returns from your opponent's Graveyard to your opponent's Deck,Continuous/Trigger,
21858819,Numéro XX : Infini Utopique des Ténèbres,Unlimited(OCG)/Unlimited(TCG),TÉNÈBRES,[Guerrier/Xyz／Effet],,,Rang 10,,,4000,4000,,2+ monstres de Niveau 10,,"Lorsqu'un monstre est détruit au combat et envoyé au Cimetière : vous pouvez détacher 1 Matériel de cette carte, puis ciblez le monstre ; Invoquez-le Spécialement sur votre Terrain en Position de Défense. Vous pouvez cibler 1 autre monstre face recto Invoqué Spécialement que vous contrôlez ; gagnez des LP égaux à son ATK d'origine. Vous ne pouvez utiliser chaque effet de ""Numéro XX : Infini Utopique des Ténèbres"" qu'une fois par tour.",,,Activates if destroyed by battle,Trigger/Ignition/Condition,
58699500,"Cherubini, Ange Ébène des Abysses Ardents",Unlimited(OCG)/Unlimited(TCG),TÉNÈBRES,[Elfe/Lien／Effet],Lien 2,Bottom-Left/Bottom-Right,,,,500,-,,,,"2 monstres de Niveau 3Les monstres pointés par cette carte ne peuvent pas être détruits par des effets de carte. Si cette carte va être détruite au combat ou par un effet de carte de l'adversaire, vous pouvez envoyer 1 autre carte que vous contrôlez au Cimetière à la place. Vous pouvez envoyer 1 monstre de Niveau 3 depuis votre Deck au Cimetière, puis ciblez 1 monstre ""Abysses Ardents"" sur le Terrain ; jusqu'à la fin de ce tour, il gagne une ATK/DEF égales à l'ATK/DEF du monstre envoyé au Cimetière. Vous ne pouvez utiliser cet effet de ""Cherubini, Ange Ébène des Abysses Ardents"" qu'une fois par tour.",Supports archetypes /Burning Abyss,,Sends from your field to your Graveyard/Sends from your Deck to your Graveyard for cost,Continuous/Ignition/Condition,
63509474,Sauvetage Poisson à Chair Blanche,Unlimited(OCG)/Unlimited(TCG),MAGIE,,,,,,,,,,,,"Vous pouvez cibler 1 monstre Poisson dans votre Cimetière ; ajoutez-le à votre main. Vous ne pouvez utiliser cet effet de ""Sauvetage Poisson à Chair Blanche"" qu'une fois par tour. Si cette carte en votre possession est détruite par un effet de carte de l'adversaire et envoyée à votre Cimetière : prenez 1 monstre Poisson depuis votre Deck, et soit ajoutez-le à votre main soit Invoquez-le Spécialement.",Fish,,Adds from Graveyard to hand/Activates if destroyed by card effect/Activates from your Graveyard/Adds from Deck to hand,Ignition-like/Condition/Trigger-like,
84731222,Souvenirs d'Espoir,Unlimited(OCG)/Unlimited(TCG),MAGIE,,,,,,,,,,,,"Piochez un nombre de cartes égal au nombre de Monstres Xyz ""Numéro"" de noms différents que vous contrôlez. Vous ne pouvez activer qu'1 ""Souvenirs d'Espoir"" par tour.",Supports archetypes /Number,,You draw cards,Effect/Condition,
