Passcode,Name,Status,Attribute,type,link,link_arrows,rank,pendulum_scale,level,attack,defense,spell_attribute,summoning_condition,pendulum_condition,card_text,card_supports,card_anti_supports,card_actions,effect_types,
02009101,Aile Noire - Mistral le Tourbillon,Unlimited(OCG)/Unlimited(TCG),TÉNÈBRES,[Bête Ailée/Syntoniseur／Effet],,,,,Niveau 3,1300,400,,,,"Si vous contrôlez un monstre ""Aile Noire"" (""Aile Noire - Mistral le Tourbillon"" exclu), vous pouvez Invoquer Spécialement cette carte (depuis votre main). Une fois par tour : vous pouvez cibler 1 monstre face recto contrôlé par votre adversaire ; l'ATK/DEF de la cible deviennent la moitié de son ATK/DEF actuelles.",Supports archetypes /Blackwing,,,Summon/Ignition,
49003716,Aile Noire - Bora la Lance,Unlimited(OCG)/Unlimited(TCG),TÉNÈBRES,[Bête Ailée/Effet],,,,,Niveau 4,1700,800,,,,"Si vous contrôlez un monstre ""Aile Noire"" (""Aile Noire - Bora la Lance"" exclu), vous pouvez Invoquer Spécialement cette carte (depuis votre main). Si cette carte attaque un monstre en Position de Défense, infligez des dommages de combat perçants.",Supports archetypes /Blackwing,,,Summon/Continuous,
22835145,"Aile Noire - Blizzard, la Tempête d'Extrême Nord",Unlimited(OCG)/Unlimited(TCG),TÉNÈBRES,[Bête Ailée/Syntoniseur／Effet],,,,,Niveau 2,1300,0,,,,"Non Invocable Spécialement. Lorsque cette carte est Invoquée Normalement : vous pouvez cibler 1 monstre ""Aile Noire"" de max. Niveau 4 dans votre Cimetière ; Invoquez Spécialement la cible en Position de Défense.",Supports archetypes /Blackwing,,Activates upon Normal Summon,Summon/Trigger,
58820853,Aile Noire - Shura la Flamme Bleue,Unlimited(OCG)/Unlimited(TCG),TÉNÈBRES,[Bête Ailée/Effet],,,,,Niveau 4,1800,1200,,,,"Lorsque cette carte détruit un monstre de votre adversaire au combat et l'envoie au Cimetière : vous pouvez Invoquer Spécialement 1 monstre ""Aile Noire"" avec max. 1500 ATK depuis votre Deck, mais ses effets sont annulés.",Supports archetypes /Blackwing,,,Trigger,
11613567,Aile Noire - Elphin le Corbeau Funeste,Unlimited(OCG)/Unlimited(TCG),TÉNÈBRES,[Bête Ailée/Effet],,,,,Niveau 6,2200,1200,,,,"Si vous contrôlez un monstre ""Aile Noire"", vous pouvez Invoquer Normalement cette carte sans Sacrifice. Lorsque cette carte est Invoquée Normalement : vous pouvez cibler 1 monstre contrôlé par votre adversaire ; changez la position de combat de la cible.",Supports archetypes /Blackwing,,Changes battle positions,Summon/Trigger,
46710683,Aile Noire - Mistral le Bouclier d'Argent,Unlimited(OCG)/Unlimited(TCG),TÉNÈBRES,[Bête Ailée/Syntoniseur／Effet],,,,,Niveau 2,100,1800,,,,Si cette carte sur le Terrain est détruite et envoyée au Cimetière : réduisez les prochains dommages de combat que vous allez recevoir ce tour à 0.,,,Activates from your Graveyard,Trigger,
09109991,Aile Noire - Foehn la Chaîne d'Acier (Actualisé de : Aile Noire - Foehn la Chaîne de Fer),Unlimited(OCG)/Unlimited(TCG),TÉNÈBRES,[Bête Ailée/Effet],,,,,Niveau 2,500,800,,,,Cette carte peut attaquer directement votre adversaire. Si cette carte inflige des dommages de combat à votre adversaire par une attaque directe : ciblez 1 monstre en Position d'Attaque contrôlé par votre adversaire ; changez la cible en Position de Défense.,,,Changes battle positions,Continuous/Trigger,
26775203,Aile Noire - Ghibli le Vent Flamboyant,Unlimited(OCG)/Unlimited(TCG),TÉNÈBRES,[Bête Ailée/Effet],,,,,Niveau 3,0,1600,,,,"Lorsque votre adversaire déclare une attaque directe : vous pouvez Invoquer Spécialement cette carte depuis votre main. Une fois par tour : jusqu'à la fin de ce tour, vous pouvez échanger l'ATK et la DEF d'origine de cette carte.",,,Activates from your hand/Activates upon attack declaration,Trigger/Ignition,
52869807,Aile Noire - Rafale la Bourrasque,Unlimited(OCG)/Unlimited(TCG),TÉNÈBRES,[Bête Ailée/Effet],,,,,Niveau 2,900,1400,,,,"Si vous ne contrôlez aucune carte, vous pouvez Invoquer Spécialement cette carte (depuis votre main). Si un monstre de votre adversaire attaque un monstre ""Aile Noire"" que vous contrôlez : le monstre attaquant perd 300 ATK durant la Damage Step uniquement.",Supports archetypes /Blackwing,,,Summon/Continuous,
41902352,Aile Noire - Kochi l'Aube,Unlimited(OCG)/Unlimited(TCG),TÉNÈBRES,[Bête Ailée/Syntoniseur／Effet],,,,,Niveau 4,700,1500,,,,"Si cette carte a été Invoquée Spécialement, elle ne peut pas être utilisée comme Matériel de Synchro.",,,Activates upon Special Summon,Condition,
87390067,Aile Noire - Jet le Ciel Bleu,Unlimited(OCG)/Unlimited(TCG),TÉNÈBRES,[Bête Ailée/Effet],,,,,Niveau 1,100,800,,,,"Durant le calcul des dommages, vous pouvez envoyer cette carte depuis votre main au Cimetière pour empêcher un monstre ""Aile Noire"" que vous contrôlez d'être détruit par ce combat.",Supports archetypes /Blackwing,,Sends itself from hand to Graveyard for cost,Quick,
14785765,Aile Noire - Zephyros l'Élite,Unlimited(OCG)/Unlimited(TCG),TÉNÈBRES,[Bête Ailée/Effet],,,,,Niveau 4,1600,1000,,,,"Si cette carte est dans votre Cimetière : vous pouvez renvoyer 1 carte face recto que vous contrôlez à la main ; Invoquez Spécialement cette carte, et si vous le faites, recevez 400 points de dommages. Vous ne pouvez utiliser cet effet de ""Aile Noire - Zephyros l'Élite"" qu'une fois par Duel.",,,Activates from your Graveyard/Returns from field to hand for cost/Returns from your field to your hand,Ignition/Condition,
69031175,Aile Noire - Maître des Armures,Unlimited(OCG)/Unlimited(TCG),TÉNÈBRES,[Bête Ailée/Synchro／Effet],,,,,Niveau 7,2500,1500,,"1 Syntoniseur ""Aile Noire"" + 1+ monstre non-Syntoniseur",,"Non destructible au combat, et vous ne recevez aucun dommage de combat d'attaques impliquant cette carte. À la fin de la Damage Step, si cette carte a attaqué un monstre : vous pouvez placer 1 Compteur Cuirasse sur le monstre (max. 1). Vous pouvez retirer tous les Compteurs Cuirasse des monstres de votre adversaire ; jusqu'à la fin de ce tour, l'ATK/DEF de ces monstres qui avaient des Compteurs Cuirasse deviennent 0.",Supports archetypes /Blackwing,,,Continuous/Trigger/Ignition,
76913983,Aile Noire - Arsenal Aérien,Unlimited(OCG)/Unlimited(TCG),TÉNÈBRES,[Bête Ailée/Synchro／Effet],,,,,Niveau 6,2300,1000,,"1 Syntoniseur ""Aile Noire"" + 1+ monstre non-Syntoniseur",,"Si cette carte attaque un monstre en Position de Défense, elle gagne 500 ATK durant la Damage Step uniquement, et aussi, infligez des dommages de combat perçants.",Supports archetypes /Blackwing,,,Continuous,
33236860,Aile Noire - Vent d'Argent le Suprême,Unlimited(OCG)/Unlimited(TCG),TÉNÈBRES,[Bête Ailée/Synchro／Effet],,,,,Niveau 8,2800,2000,,"1 Syntoniseur ""Aile Noire"" + 2 monstres non-Syntoniseur ou plus",,"Lorsque cette carte est Invoquée par Synchronisation : vous pouvez cibler max. 2 monstres face recto sur le Terrain avec une DEF inférieure à l'ATK de cette carte ; détruisez les cibles. Vous ne pouvez pas mener votre Battle Phase le tour où vous activez cet effet. Durant chacun des tours de votre adversaire, le premier monstre ""Aile Noire"" que vous contrôlez qui va être détruit au combat n'est pas détruit.",Supports archetypes /Blackwing,,Activates upon Synchro Summon/Cannot conduct Battle Phase,Trigger/Condition/Continuous,
09012916,Dragon Ailes Sombres,Unlimited(OCG)/Unlimited(TCG),TÉNÈBRES,[Dragon/Synchro／Effet],,,,,Niveau 8,2800,1600,,1 Syntoniseur + 1+ monstre non-Syntoniseur,,"Si vous allez recevoir des dommages d'un effet de carte, placez 1 Compteur Plumes Noires sur cette carte à la place. Cette carte perd 700 ATK pour chaque Compteur Plumes Noires sur elle. Une fois par tour : vous pouvez retirer tous les Compteurs Plumes Noires de cette carte, puis ciblez 1 monstre face recto contrôlé par votre adversaire ; la cible perd 700 ATK pour chaque Compteur Plumes Noires retiré, et si elle le fait, infligez des dommages à votre adversaire égaux à l'ATK perdue par cet effet.",,,,Continuous/Ignition,
64952266,Puissance du Vent,Unlimited(OCG)/Unlimited(TCG),MAGIE,,,,,,,,,,,,"Sélectionnez 1 monstre ""Aile Noire"" dans votre Cimetière. Recevez des dommages égaux à l'ATK du monstre sélectionné, et ajoutez-le à votre main.",Supports archetypes /Blackwing,,Adds from Graveyard to hand,Effect,
04168871,Cartes Plumes Noires,Unlimited(OCG)/Unlimited(TCG),MAGIE,,,,,,,,,,,,"Bannissez 1 monstre ""Aile Noire"" monstre depuis votre main ; piochez 2 cartes. Vous ne pouvez pas Invoquer Spécialement durant le tour où vous activez cette carte. Vous ne pouvez activer qu'1 ""Cartes Plumes Noires"" par tour.",Supports archetypes /Blackwing,,You draw cards,Cost/Effect/Condition,
88341502,Flèche d'Ébène,Unlimited(OCG)/Unlimited(TCG),PIÈGE,,,,,,,,,,,,"Sélectionnez 1 monstre face recto que vous contrôlez. Jusqu'à la End Phase, il perd 500 ATK et durant un combat entre cette carte attaquant et un monstre en Position de Défense dont la DEF est inférieure à l'ATK du monstre sélectionné, infligez la différence en tant que dommages de combat à votre adversaire. Lorsque le monstre sélectionné détruit un monstre au combat et l'envoie au Cimetière ce tour, infligez des dommages à votre adversaire égaux à la DEF d'origine du monstre détruit.",,,,Effect/Trigger-like,
22628574,Plume de Duplication,Unlimited(OCG)/Unlimited(TCG),PIÈGE,,,,,,,,,,,,"Envoyez 1 monstre ""Aile Noire"" depuis votre main au Cimetière et sélectionnez 1 Carte Piège Normal dans le Cimetière de votre adversaire. L'effet de cette carte est le même que la Carte Piège Normal sélectionnée.",Supports archetypes /Blackwing,Normal Trap Card,Sends from your hand to your Graveyard for cost/Resolves as another card's effect,Cost/Effect,
89040386,Aile Noire - Bourrasque,Unlimited(OCG)/Unlimited(TCG),PIÈGE,,,,,,,,,,,,"Lorsqu'un monstre de votre adversaire déclare une attaque directe tant que vous avez min. 5 monstres ""Aile Noire"" dans votre Cimetière : détruisez tous les monstres contrôlés par votre adversaire.",Supports archetypes /Blackwing,,Activates upon attack declaration,Activation requirement/Effect,
25435080,Aile Noire - Bombardement,Unlimited(OCG)/Unlimited(TCG),PIÈGE,,,,,,,,,,,,"Sacrifiez 1 monstre ""Aile Noire"" pour sélectionner 1 Monstre Synchro face recto que vous contrôlez. Ce Monstre Synchro gagne un montant d'ATK égal à l'ATK du monstre Sacrifié, jusqu'à la End Phase.",Supports archetypes /Blackwing,,Tributes for cost,Cost/Effect,
40279770,Balise Plume Noire,Unlimited(OCG)/Unlimited(TCG),PIÈGE,,,,,,,,,,,,"Activable uniquement lorsque vous recevez des dommages par l'effet d'une carte. Invoquez Spécialement 1 monstre ""Aile Noire"" de Niveau 4 ou moins depuis votre main.",Supports archetypes /Blackwing,,Activates if you take effect damage,Activation requirement/Effect,
