Passcode,Name,Status,Attribute,type,link,link_arrows,rank,pendulum_scale,level,attack,defense,spell_attribute,summoning_condition,pendulum_condition,card_text,card_supports,card_anti_supports,card_actions,effect_types,
66970002,Numéro C39 : Rayon Utopie V,Unlimited(OCG)/Unlimited(TCG),LUMIÈRE,[Guerrier/Xyz／Effet],,,Rang 5,,,2600,2000,,3 monstres de Niveau 5,,"Lorsque cette carte en possession de son propriétaire est détruite par une carte de l'adversaire : vous pouvez cibler 1 Monstre Xyz dans votre Cimetière ; renvoyez la cible à l'Extra Deck. Si cette carte a un monstre ""Utopie"" comme Matériel, elle gagne cet effet.●Une fois par tour : vous pouvez détacher 1 Matériel de cette carte, puis ciblez 1 monstre contrôlé par votre adversaire ; détruisez le monstre, et s'il était face recto, infligez des dommages à votre adversaire égaux à l'ATK que le monstre détruit avait sur le Terrain.",Supports archetypes /Utopia ,,Activates from your Graveyard/Returns from your Graveyard to your Extra Deck,Trigger/Condition/Ignition,
92365601,Force de Barian Restreinte Magie-Rang-Plus,Unlimited(OCG)/Unlimited(TCG),MAGIE,,,,,,,,,,,,"Ciblez 1 Monstre Xyz de Rang 4 que vous contrôlez ; Invoquez Spécialement 1 monstre ""Numéro C"" qui a 1 Rang de plus que le monstre que vous contrôlez depuis votre Extra Deck, en l'utilisant comme le Matériel Xyz. (Cette Invocation Spéciale est traitée comme une Invocation Xyz. Les Matériels Xyz attachés à la cible deviennent aussi des Matériels Xyz du monstre Invoqué.)",Supports archetypes /Number C,,Transfers,Effect/Condition,
81330115,Numéro 30 : Golem Acide de Destruction,Unlimited(OCG)/Unlimited(TCG),EAU,[Rocher/Xyz／Effet],,,Rang 3,,,3000,3000,,2 monstres de Niveau 3,,"Durant votre Standby Phase : détachez 1 Matériel Xyz de cette carte ou recevez 2000 points de dommages. Vous ne pouvez pas Invoquer Spécialement de monstres. Tant que cette carte n'a pas de Matériel Xyz, elle ne peut pas attaquer.",,,Detaches Xyz Materials for effect,Trigger/Continuous,
97170107,Elfe Étincelant,Unlimited(OCG)/Unlimited(TCG),VENT,[Magicien/Xyz／Effet],,,Rang 2,,,1600,1000,,2 monstres de Niveau 2,,Lorsque votre adversaire Invoque Normalement ou Spécialement un ou plusieurs monstres (sauf durant la Damage Step) : vous pouvez détacher 1 Matériel Xyz de cette carte ; ces monstres perdent 500 ATK.,,,,Trigger,
09161357,Numéro 6 : Atlandis Chronomal,Unlimited(OCG)/Unlimited(TCG),LUMIÈRE,[Machine/Xyz／Effet],,,Rang 6,,,2600,3000,,2 monstres de Niveau 6,,"Lorsque cette carte est Invoquée par Xyz : vous pouvez cibler 1 monstre ""Numéro"" dans votre Cimetière ; équipez la cible à cette carte. Cette carte gagne une ATK égale à la moitié de l'ATK du monstre équipé. Une fois par tour : vous pouvez détacher 1 Matériel Xyz de cette carte, puis envoyez le monstre équipé par cet effet au Cimetière ; divisez par deux les Life Points de votre adversaire. Vous ne pouvez pas mener votre Battle Phase le tour où vous activez cet effet.",Supports archetypes /Number,,Activates upon Xyz Summon/Equips monsters from the player's Graveyard to itself/Sends from field to Graveyard for cost/Cannot conduct Battle Phase,Trigger/Continuous/Ignition/Condition,
05318639,Typhon d'Espace Mystique,Unlimited(OCG)/Unlimited(TCG)/Limited 1(TCGSpeed Duel),MAGIE,,,,,,,,,,,,Ciblez 1 Magie/Piège sur le Terrain ; détruisez la cible.,,,,Effect,
72302403,Épées de Révélation de la Lumière,Unlimited(OCG)/Unlimited(TCG)/Unlimited(TCGSpeed Duel),MAGIE,,,,,,,,,,,,"Après activation de cette carte, elle reste sur le Terrain, mais vous devez la détruire durant la End Phase du 3e tour de votre adversaire. Lorsque cette carte est activée : si votre adversaire contrôle un monstre face verso, retournez face recto tous les monstres qu'il contrôle. Tant que cette carte est face recto sur le Terrain, les monstres de votre adversaire ne peuvent pas déclarer d'attaque.",,,Flips monsters face-up,Condition/Effect/Continuous-like,
44095762,Force de Miroir,Unlimited(OCG)/Unlimited(TCG),PIÈGE,,,,,,,,,,,,Lorsqu'un monstre de l'adversaire déclare une attaque : détruisez tous les monstres en Position d'Attaque de votre adversaire.,,,Activates upon attack declaration,Activation requirement/Effect,
