Passcode,Name,Status,Attribute,type,link,link_arrows,rank,pendulum_scale,level,attack,defense,spell_attribute,summoning_condition,pendulum_condition,card_text,card_supports,card_anti_supports,card_actions,effect_types,
15590355,Réalisation Libromancienne,Unlimited(OCG)/Unlimited(TCG),MAGIE,,,,,,,,,,,,"Vous pouvez révéler 1 Monstre Rituel ""Libromancien"" dans votre main : Invoquez Spécialement 1 ""Jeton Feu"" (Cyberse/FEU/ATK 0/DEF 0) du même Niveau que le monstre révélé. Tant que vous contrôlez le Jeton, vous ne pouvez pas Invoquer Spécialement de monstres (monstres ""Libromancien"" exclus). Vous ne pouvez utiliser cet effet de ""Réalisation Libromancienne"" qu'une fois par tour.",Supports archetypes /Libromancer,,Reveals cards in your hand,Ignition-like/Condition,
41085464,Union Libromancienne,Unlimited(OCG)/Unlimited(TCG),MAGIE,,,,,,,,,,,,"Cette carte peut être utilisée pour Invoquer Rituellement un Monstre Rituel ""Libromancien"". Vous devez aussi Sacrifier des monstres depuis votre main ou Terrain dont le Niveau total est supérieur ou égal au Niveau du Monstre Rituel que vous Invoquez Rituellement. Si vous Invoquez Rituellement ""Fireburst Libromancien"" avec cet effet, en utilisant ""Firestarter Libromancien"" sur le Terrain, il ne peut être ni détruit ni banni par des effets de carte.",Supports archetypes /Libromancer,,Tributes as an effect,,
88083109,Déplacement Libromancien,Unlimited(OCG)/Unlimited(TCG),PIÈGE,,,,,,,,,,,,"Ciblez 1 monstre ""Libromancien"" que vous contrôlez et 1 monstre contrôlé par votre adversaire ; renvoyez votre monstre à la main, et si vous le faites, prenez le contrôle du monstre de l'adversaire. Si votre monstre ""Libromancien"" que vous avez ciblé n'était pas un Monstre Rituel, le monstre dont vous avez pris le contrôle est renvoyé à la main durant la End Phase. Vous ne pouvez activer qu'1 ""Déplacement Libromancien"" par tour.",Supports archetypes /Libromancer,,Returns from your field to your hand/Changes control,Effect/Condition,
14478717,Prévention Libromancienne,Unlimited(OCG)/Unlimited(TCG),PIÈGE,,,,,,,,,,,,"Si vous contrôlez un monstre ""Libromancien"" : vous pouvez cibler 1 monstre face recto contrôlé par votre adversaire ; ce tour, le monstre face recto ne peut pas être utilisé comme Matériel pour une Invocation Fusion, Synchro, Xyz ou Lien. Vous ne pouvez utiliser cet effet de ""Prévention Libromancienne"" qu'une fois par tour. Une fois par tour, durant la End Phase, si vous ne contrôlez aucun Monstre Rituel ""Libromancien"" : envoyez cette carte au Cimetière.",Supports archetypes /Libromancer,,Sends itself from field to Graveyard,,
13256226,"Esprit de Néos, HÉROS Élémentaire",Unlimited(OCG)/Unlimited(TCG),LUMIÈRE,[Guerrier/Effet],,,,,Niveau 7,2500,2000,,,,"Lorsqu'un monstre de l'adversaire déclare une attaque : vous pouvez Invoquer Spécialement cette carte depuis votre main en Position de Défense, et si vous le faites, elle ne peut pas être détruite au combat. Si cette carte est Invoquée Spécialement : vous pouvez ajouter 1 ""Polymérisation"" ou 1 Magie/Piège qui mentionne un nom de carte de monstre ""HÉROS Élémentaire"" depuis votre Deck à votre main. Durant votre Main Phase : vous pouvez mélanger cette carte dans le Deck, et si vous le faites, Invoquez Spécialement 1 Monstre Normal ""HÉROS Élémentaire"" depuis votre Deck. Vous ne pouvez utiliser chaque effet de ""Esprit de Néos, HÉROS Élémentaire"" qu'une fois par tour.",Supports archetypes /Elemental HERO,,Activates upon attack declaration/Activates upon Special Summon/Adds from Deck to hand/Returns itself from field to Deck for cost,Trigger/Ignition/Condition,
40740224,Garde de Dimension,Unlimited(OCG)/Unlimited(TCG),TÉNÈBRES,[Guerrier/Effet],,,,,Niveau 2,400,400,,,,"Vous pouvez envoyer cette carte depuis votre main ou Terrain au Cimetière ; Invoquez Spécialement 1 monstre ""HÉROS Élémentaire"" ou 1 monstre ""Néo-Spacien"" depuis votre main ou Cimetière, mais annulez ses effets s'il est Invoqué depuis le Cimetière. Si vous Invoquez Spécialement un Monstre Fusion ""HÉROS Élémentaire"", tant que cette carte est dans votre Cimetière (sauf durant la Damage Step) : vous pouvez bannir cette carte ; piochez 2 cartes, puis placez 1 carte depuis votre main au-dessous du Deck. Vous ne pouvez utiliser chaque effet de ""Garde de Dimension"" qu'une fois par tour.",Supports archetypes /Elemental HERO/Neo-Spacian,,Sends itself from hand to Graveyard for cost/Sends itself from field to Graveyard for cost/Places cards from the player's hand on the bottom of the Deck/You draw cards,Ignition/Trigger/Condition,
48806195,"Therion ""Impératrice"" Alasia",Unlimited(OCG)/Unlimited(TCG),TERRE,[Reptile/Effet],,,,,Niveau 8,2100,2500,,,,"Vous ne pouvez utiliser chacun des effets suivants de ""Therion ""Impératrice"" Alasia"" qu'une fois par tour.●Vous pouvez cibler 1 monstre ""Therion"" ou 1 monstre Reptile dans votre Cimetière ; Invoquez Spécialement cette carte depuis votre main, et si vous le faites, équipez le monstre à cette carte.●Vous pouvez défausser 1 carte, puis ciblez 1 Carte Monstre ""Therion"" dans votre Zone Magie & Piège ; Invoquez-la Spécialement.Un monstre ""Therion"" équipé avec cette carte gagne 700 ATK, et aussi, il peut activer le 2e effet listé ci-dessus comme s'il était ""Therion ""Impératrice"" Alasia"".",Supports archetypes /Therion,,,Condition/Ignition/Ignition/Continuous-like,
75290703,Irrégulier Therion,Unlimited(OCG)/Unlimited(TCG),TÉNÈBRES,[Machine/Effet],,,,,Niveau 10,1600,2800,,,,"Vous pouvez cibler max. 3 monstres ""Therion"" dans votre Cimetière ; Invoquez Spécialement cette carte depuis votre main, et si vous le faites, équipez-les à cette carte. Vous pouvez défausser 1 ""Moteur Infini Système Argyro"" ; détruisez toutes les cartes contrôlées par votre adversaire. Tant que cette carte est équipée à un monstre : vous pouvez Invoquer Spécialement cette carte, puis équipez le monstre qui était équipé avec cette carte à cette carte. Vous ne pouvez utiliser chaque effet de ""Irrégulier Therion"" qu'une fois par tour.",Supports archetypes /Therion,,Equips from the player's Graveyard/Equips monsters from the player's field to itself,Ignition/Ignition/Ignition-like/Condition,
37683547,Albaz le Cendreux,Unlimited(OCG)/Unlimited(TCG),TÉNÈBRES,[Dragon/Effet],,,,,Niveau 4,1800,0,,,,"Le nom de cette carte devient ""Albaz le Déchu"" tant qu'elle est sur le Terrain ou dans le Cimetière. Tant qu'un Monstre Fusion de Niveau 8 est dans votre Cimetière, cette carte gagne 200 ATK pour chaque monstre dans votre Cimetière, et aussi, votre adversaire ne peut pas cibler d'autres monstres que vous contrôlez avec des effets de carte. Si un ou plusieurs monstres que vous contrôlez quittent le Terrain par un effet de carte de l'adversaire, tant que cette carte et un Monstre Fusion sont dans votre Cimetière (sauf durant la Damage Step) : vous pouvez Invoquer Spécialement cette carte. Vous ne pouvez utiliser cet effet de ""Albaz le Cendreux"" qu'une fois par tour.",Fallen of Albaz/Fusion Monster,,,Unclassified/Continuous/Trigger/Condition,
61011438,Rose Brillante,Unlimited(OCG)/Unlimited(TCG),LUMIÈRE,[Rocher/Effet],,,,,Niveau 2,500,500,,,,"(Cette carte est toujours traitée comme une carte ""Chevalier-Gemmes"".)Vous pouvez défausser 1 carte ""Chevalier-Gemmes"" ou ""Musique"" ; Invoquez Spécialement cette carte depuis votre main. Vous ne pouvez utiliser cet effet de ""Rose Brillante"" qu'une fois par tour. Une fois par tour : vous pouvez envoyer 1 monstre ""Chevalier-Gemmes"" ou ""Musique"" depuis votre Extra Deck au Cimetière ; jusqu'à la End Phase, le nom/Type/Attribut de cette carte deviennent les mêmes que le nom/Type/Attribut d'origine du monstre envoyé au Cimetière pour activer cet effet.",Supports archetypes /Gem-Knight/Melodious,,Discards for cost/Activates from your hand/Sends from Extra Deck to Graveyard for cost,Condition/Ignition/Condition/Ignition,
37343995,Exosœur Martha,Unlimited(OCG)/Unlimited(TCG),LUMIÈRE,[Magicien/Effet],,,,,Niveau 4,1600,800,,,,"Si vous ne contrôlez aucun monstre, ou uniquement des Monstres Xyz : vous pouvez Invoquer Spécialement cette carte depuis votre main, et si vous le faites, Invoquez Spécialement 1 ""Exosœur Elis"" depuis votre Deck. Vous ne pouvez pas Invoquer Spécialement de monstres (monstres ""Exosœur"" exclus) le tour où vous activez cet effet. Si une ou plusieurs cartes sortent d'au moins l'un des Cimetières (sauf durant la Damage Step) : vous pouvez Invoquer Spécialement 1 Monstre Xyz ""Exosœur"" depuis votre Extra Deck, en utilisant cette carte face recto que vous contrôlez comme Matériel. (Ceci est traité comme une Invocation Xyz.) Vous ne pouvez utiliser chaque effet de ""Exosœur Martha"" qu'une fois par tour.",Supports archetypes /Exosister,,,Ignition/Condition/Trigger/Condition,
35283277,"Eka, Pote des Flammes",Unlimited(OCG)/Unlimited(TCG),FEU,[Guerrier/Effet],,,,,Niveau 4,1500,200,,,,"Si cette carte est Invoquée Normalement ou Spécialement : vous pouvez cibler 1 Carte Monstre face recto dans la Zone Magie & Piège de l'un des joueurs ; Invoquez-la Spécialement sur votre Terrain. Vous pouvez cibler 1 autre monstre face recto que vous contrôlez ; équipez le monstre face recto à cette carte comme une Magie d'Équipement qui lui donne 500 ATK. Vous ne pouvez utiliser chaque effet de ""Eka, Pote des Flammes"" qu'une fois par tour.",,,,Trigger/Ignition/Condition,
61681816,Propa Gandake,Unlimited(OCG)/Unlimited(TCG),EARTH,[Psychic/Effect],,,,,3,500,2000,,,,"Once per turn, if you control a monster(s) whose original Type is Beast, Insect, Plant, or Rock: You can declare 1 of those Types you control; this card becomes that declared Type. If this card has applied this effect, also apply the following effects while it remains in the Monster Zone.●All face-up monsters on the field become the same Type as this card.●Monsters on the field with this card's Type cannot be targeted by either player using the effects of monsters your opponent controls with that same Type.",Beast/Insect/Plant/Rock,,,Ignition/Continuous,
94076521,Cartorhyn la Gemme Cachée du Front de Mer,Unlimited(OCG)/Unlimited(TCG),EAU,[Rocher/Effet],,,,,Niveau 2,500,1600,,,,"Vous pouvez défausser cette carte ; durant votre Main Phase ce tour, vous pouvez Invoquer Normalement 1 monstre TERRE ou EAU, en plus de votre Invocation/Pose Normale. (Vous ne pouvez gagner cet effet qu'une fois par tour.) Si vous contrôlez un ou plusieurs monstres TERRE et EAU, tant que cette carte est dans votre Cimetière : vous pouvez Invoquer Spécialement cette carte, mais bannissez-la lorsqu'elle quitte le Terrain. Vous ne pouvez utiliser chaque effet de ""Cartorhyn la Gemme Cachée du Front de Mer"" qu'une fois par tour.",EARTH/WATER,,,Ignition/Ignition/Condition,
66569334,Nightmell le Connecteur des Ténèbres,Unlimited(OCG)/Unlimited(TCG),VENT,[Psychique/Effet],,,,,Niveau 4,1500,1500,,,,"Vous pouvez Sacrifier 1 monstre ; Invoquez Spécialement 1 monstre du même Type, Attribut, Niveau et ATK/DEF d'origine que le monstre Sacrifié, mais de nom d'origine différent, depuis votre Deck. Si vous avez Sacrifié un monstre Invoqué Spécialement depuis l'Extra Deck, vous pouvez Invoquer Spécialement un monstre depuis votre Extra Deck à la place qui remplit ces mêmes critères. Vous ne pouvez utiliser cet effet de ""Nightmell le Connecteur des Ténèbres"" qu'une fois par tour.",,,,Ignition/Condition,
55610199,"Diamant Rose, Dame Chevalier-Gemmes",Unlimited(OCG)/Unlimited(TCG),TERRE,[Elfe/Fusion／Effet],,,,,Niveau 8,2700,2400,,"1 monstre ""Chevalier-Gemmes"" + 1 monstre Elfe",,"Une fois par tour de l'adversaire, la première fois qu'un ou plusieurs monstres ""Chevalier-Gemmes"" que vous contrôlez vont être détruits par un effet de carte, ils ne sont pas détruits. Durant votre tour, lorsque votre adversaire active un effet de monstre (Effet Rapide) : vous pouvez bannir 1 carte ""Chevalier-Gemmes"" depuis votre Cimetière, puis ciblez 1 carte face recto contrôlée par votre adversaire ; détruisez-la.",Supports archetypes /Gem-Knight,,,Continuous/Quick,
53776969,Lumière-Heart Griffrayeur,Unlimited(OCG)/Unlimited(TCG),TÉNÈBRES,[Bête-Guerrier/Lien／Effet],Lien 1,Left,,,,500,-,,,,"1 monstre ""Griffrayeur"" ou 1 ""Visas Starfrost""Pour l'Invocation Lien de cette carte, vous ne pouvez utiliser que des monstres dans votre Zone Monstre Main comme Matériel. Si cette carte est Invoquée par Lien dans la Zone Monstre Extra : vous pouvez ajouter 1 ""Planète Primitive Reichphobia"" depuis votre Deck à votre main. Si vous contrôlez ""Visas Starfrost"" : vous pouvez Invoquer Spécialement cette carte depuis votre Cimetière. Vous ne pouvez utiliser cet effet de ""Lumière-Heart Griffrayeur"" qu'une fois par Duel.",Supports archetypes /Scareclaw,,Activates upon Link Summon/Adds from Deck to hand,Condition/Trigger/Ignition/Condition,
14220547,Marqué du Dogmatika Fondamental,Unlimited(OCG)/Unlimited(TCG),MAGIE,,,,,,,,,,,,"Si vous Invoquez Spécialement 1 Monstre Rituel (et aucune autre carte) par une Carte Magie ou effet de Magie (sauf durant la Damage Step) : vous pouvez regarder l'Extra Deck de l'un des joueurs, et envoyez 1 monstre depuis celui-ci au Cimetière. Si vous Invoquez Spécialement 1 Monstre Fusion (et aucune autre carte) par une Carte Magie ou effet de Magie (sauf durant la Damage Step) : vous pouvez cibler le monstre ; le reste de ce tour, il gagne une ATK égale à son ATK d'origine, et aussi, il ne peut attaquer que des monstres en Position d'Attaque contrôlés par votre adversaire. Vous ne pouvez utiliser chaque effet de ""Marqué du Dogmatika Fondamental"" qu'une fois par tour.",Ritual Monster/Fusion Monster,,Sends from your Extra Deck to your Graveyard/Sends from your opponent's Extra Deck to your opponent's Graveyard,Trigger-like/Trigger-like/Condition,
41619242,Chevauchement Griffrayeur,Unlimited(OCG)/Unlimited(TCG),MAGIE,,,,,,,,,,,,"Vous pouvez activer 1 des effets suivants.●Ciblez 1 monstre ""Griffrayeur"" ou 1 ""Visas Starfrost"" dans votre Zone Monstre, et 1 monstre face recto contrôlé par votre adversaire ; votre monstre gagne une ATK/DEF égales à l'ATK ou DEF du monstre de votre adversaire (la plus haute valeur).●Lorsqu'une carte ou un effet qui cible ""Visas Starfrost"" ou un monstre ""Griffrayeur"" que vous contrôlez est activé : annulez l'effet.Vous ne pouvez activer qu'1 ""Chevauchement Griffrayeur"" par tour.",Supports archetypes /Scareclaw,,,Effect/Condition,
76981308,Concours de Regard Melffy,Unlimited(OCG)/Unlimited(TCG),MAGIE,,,,,,,,,,,,"Vous pouvez révéler 1 monstre Bête dans votre main ; ajoutez 1 monstre ""Melffy"" de nom différent depuis votre Deck ou Cimetière à votre main, et placez le monstre révélé au-dessous du Deck. Vous ne pouvez utiliser cet effet de ""Concours de Regard Melffy"" qu'une fois par tour. Au début de la Battle Phase de votre adversaire : vous pouvez révéler un nombre de votre choix de monstres ""Melffy"" dans votre main, et gardez-les révélés durant cette Battle Phase uniquement. Les monstres contrôlés par votre adversaire perdent une ATK égale à la somme des ATK/DEF des monstres révélés par cet effet.",Supports archetypes /Melffy,,,Ignition-like/Condition/Trigger-like/Continuous-like,
01041278,Expulsion du Marqué,Unlimited(OCG)/Forbidden(TCG),PIÈGE,,,,,,,,,,,,"Sacrifiez 1 Monstre Fusion, puis ciblez 2 Monstres non-Fusion qui sont bannis et/ou dans au moins l'un des Cimetières ; Invoquez Spécialement les deux monstres, 1 sur chaque Terrain. Si vous avez Sacrifié un Monstre Fusion qui mentionne ""Albaz le Déchu"" comme Matériel pour activer cette carte, vous pouvez Invoquer Spécialement les deux monstres sur votre Terrain à la place, en Position de Défense. Vous ne pouvez activer qu'1 ""Expulsion du Marqué"" par tour.",Fusion Monster/Fallen of Albaz,,,Effect/Condition,
,Terreurs de la Surracine,,PIÈGE,,,,,,,,,,,,"Ciblez 1 carte contrôlée par votre adversaire et 1 carte dans son Cimetière ; envoyez la carte sur le Terrain au Cimetière, et si vous le faites, Posez l'autre carte depuis le Cimetière sur le Terrain de votre adversaire. Vous ne pouvez activer qu'1 ""Terreurs de la Surracine"" par tour.",,,,,
35479109,Double Tornade de Poussière Jumelle,Unlimited(OCG)/Unlimited(TCG),PIÈGE,,,,,,,,,,,,"Ciblez un nombre de votre choix de cartes Posées dans votre Zone Magie & Piège ; renvoyez cette carte à la main, ainsi qu'autant de ces cartes Posées que possible (min. 1), puis vous pouvez Poser un nombre de Magies/Pièges depuis votre main, égal au nombre de cartes renvoyées à votre main par cet effet. Vous ne pouvez activer qu'1 ""Double Tornade de Poussière Jumelle"" par tour.",,,,Effect/Condition,
11765832,"Garura, Ailes de la Vie Retentissante",Unlimited(OCG)/Unlimited(TCG),TÉNÈBRES,[Bête Ailée/Fusion／Effet],,,,,Niveau 6,1500,2400,,"2 monstres du même Type et Attribut, mais de noms différents",,"Les dommages de combat reçus par votre adversaire de combats impliquant cette carte sont doublés. Si cette carte est envoyée au Cimetière : vous pouvez piocher 1 carte. Vous ne pouvez utiliser cet effet de ""Garura, Ailes de la Vie Retentissante"" qu'une fois par tour.",,,Activates if sent to the Graveyard/Activates from your Graveyard/You draw cards,Continuous/Trigger/Condition,
47759571,"Earlie, Chevalier du Stand",Unlimited(OCG)/Unlimited(TCG),FEU,[Cyberse/Lien／Effet],Lien 2,Top-Right/Right,,,,1500,-,,,,"2 Monstres à EffetLorsqu'un monstre pointé par cette carte active son effet (sauf durant la Damage Step) (Effet Rapide) : vous pouvez cibler 1 Monstre à Effet contrôlé par votre adversaire ; jusqu'à la fin de ce tour, changez son ATK à 0, et aussi, annulez ses effets. Durant la End Phase, si cette carte est dans le Cimetière parce qu'elle a été détruite au combat ou par un effet de carte, et y a été envoyée ce tour : vous pouvez Invoquer Spécialement cette carte. Vous ne pouvez utiliser chaque effet de ""Earlie, Chevalier du Stand"" qu'une fois par tour.",,,Activates from your Graveyard,Quick/Trigger/Condition,
90659259,Convertisseur Morphtronique,Unlimited(OCG)/Unlimited(TCG),MAGIE,,,,,,,,,,,,"Ciblez 1 monstre Machine que vous contrôlez ; appliquez l'effet suivant selon sa position de combat.●Position d'Attaque : Invoquez Spécialement 1 monstre ""Morphtronique"" depuis votre Deck de nom différent du monstre ciblé, puis placez le monstre ciblé au-dessus du Deck.●Position de Défense : Changez le monstre ciblé en Position d'Attaque, et si vous le faites, Invoquez Spécialement 1 monstre Machine de max. Niveau 4 depuis votre main.Vous ne pouvez activer qu'1 ""Convertisseur Morphtronique"" par tour.",Supports archetypes /Morphtronic,,Places cards from the player's field on the top of the Deck/Changes battle positions for cost,Effect/Condition,
71187462,Aile Noire - Vâta l'Emblème du Vagabondage,Unlimited(OCG)/Unlimited(TCG),TÉNÈBRES,[Bête Ailée/Syntoniseur／Effet],,,,,Niveau 2,800,0,,,,"Si vous contrôlez un monstre ""Aile Noire"" (""Aile Noire - Vâta l'Emblème du Vagabondage"" exclu), vous pouvez Invoquer Spécialement cette carte (depuis votre main). Vous ne pouvez Invoquer Spécialement ""Aile Noire - Vâta l'Emblème du Vagabondage"" qu'une fois par tour de cette façon. Durant votre Main Phase : vous pouvez envoyer cette carte sur le Terrain au Cimetière ainsi que min. 1 monstre non-Syntoniseur ""Aile Noire"" depuis votre Deck, de façon à ce que le Niveau total envoyé est égal à exactement 8, et si vous le faites, Invoquez Spécialement 1 ""Dragon Ailes Sombres"" depuis votre Extra Deck, et aussi, vous ne pouvez pas Invoquer Spécialement de monstres (monstres TÉNÈBRES exclus) depuis l'Extra Deck le reste de ce tour. Vous ne pouvez utiliser cet effet de ""Aile Noire - Vâta l'Emblème du Vagabondage"" qu'une fois par tour.",Supports archetypes /Blackwing,,Sends itself from field to Graveyard for cost/Sends from Deck to Graveyard for cost,Unclassified/Condition/Ignition/Condition,
08571567,Aile Noire - Shamal la Tempête de Sable,Unlimited(OCG)/Unlimited(TCG),TÉNÈBRES,[Bête Ailée/Syntoniseur／Effet],,,,,Niveau 4,1600,0,,,,"Vous pouvez envoyer cette carte depuis votre main ou Terrain au Cimetière ; placez 1 ""Tourbillon Plume Noire"" depuis votre Deck face recto dans votre Zone Magie & Piège. Si ""Dragon Ailes Sombres"" ou un ou plusieurs Monstres Synchro ""Aile Noire"" sont Invoqués Spécialement sur votre Terrain, tant que cette carte est dans votre Cimetière (sauf durant la Damage Step) : vous pouvez bannir cette carte, puis ciblez 1 monstre ""Aile Noire"" dans votre Cimetière ; ajoutez-le à votre main, puis recevez 700 points de dommages. Vous ne pouvez utiliser chaque effet de ""Aile Noire - Shamal la Tempête de Sable"" qu'une fois par tour.",Supports archetypes /Blackwing,,,Ignition/Trigger/Condition,
34976176,Aile Noire - Chinook le Souffle de Neige,Unlimited(OCG)/Unlimited(TCG),TÉNÈBRES,[Bête Ailée/Effet],,,,,Niveau 2,100,700,,,,"Vous pouvez envoyer cette carte depuis votre main ou Terrain au Cimetière, puis ciblez 1 monstre face recto contrôlé par votre adversaire ; envoyez 1 Monstre Synchro ""Aile Noire"" ou 1 ""Dragon Ailes Sombres"" depuis votre Extra Deck au Cimetière, et si vous le faites, jusqu'à la fin de ce tour, le monstre ciblé perd 700 ATK, et aussi, annulez ses effets. Ceci est un Effet Rapide si vous contrôlez un Monstre Synchro TÉNÈBRES. Vous ne pouvez utiliser cet effet de ""Aile Noire - Chinook le Souffle de Neige"" qu'une fois par tour.",Supports archetypes /Blackwing,,Sends itself from hand to Graveyard for cost,Ignition/Condition/Condition,
70465810,Aile Noire - Sudri le Miroitement Fantôme,Unlimited(OCG)/Unlimited(TCG),TÉNÈBRES,[Bête Ailée/Effet],,,,,Niveau 4,1400,1400,,,,"Lorsque cette carte est Invoquée Normalement : vous pouvez ajouter 1 carte qui mentionne ""Dragon Ailes Sombres"" (""Aile Noire - Sudri le Miroitement Fantôme"" exclu) depuis votre Deck à votre main. Vous pouvez Sacrifier 1 monstre ; Invoquez Spécialement 1 ""Jeton Miroitement Fantôme"" (Bête Ailée/Syntoniseur/TÉNÈBRES/Niveau 2/ATK 700/DEF 700), puis vous recevez 700 points de dommages. Vous ne pouvez pas Invoquer Spécialement de monstres (Monstres Synchro exclus) depuis l'Extra Deck le tour où vous activez cet effet. Vous ne pouvez utiliser cet effet de ""Aile Noire - Sudri le Miroitement Fantôme"" qu'une fois par tour.",Black-Winged Dragon/Synchro Monster,,Activates upon Normal Summon/Adds from Deck to hand/Tributes as an effect,Trigger/Ignition/Condition/Condition,
07459919,Aile Noire - Zonda le Crépuscule,Unlimited(OCG)/Unlimited(TCG),TÉNÈBRES,[Bête Ailée/Effet],,,,,Niveau 6,2300,900,,,,"Vous ne pouvez pas Invoquer Spécialement de monstres (Monstres Synchro exclus) depuis l'Extra Deck. Vous ne pouvez utiliser qu'1 des effets suivants de ""Aile Noire - Zonda le Crépuscule"" par tour, et uniquement une fois le tour. Si cette carte est Invoquée Normalement ou Spécialement : vous pouvez cibler 1 monstre sur le Terrain ; renvoyez-le à la main. Vous pouvez bannir cette carte depuis votre Cimetière ; Invoquez Spécialement 1 monstre ""Aile Noire"" de min. Niveau 5 depuis votre main ou Deck, puis recevez des dommages égaux à son ATK.",Supports archetypes /Blackwing,,Activates upon Normal Summon/Activates upon Special Summon/Returns from field to hand,Continuous/Condition/Trigger/Ignition,
33854624,Bystial Magnamhut,Limited(OCG)/Limited(TCG),DARK,[Dragon/Effect],,,,,6,2500,2000,,,,"You can target 1 LIGHT or DARK monster in either GY; banish it, and if you do, Special Summon this card from your hand. This is a Quick Effect if your opponent controls a monster. If this card is Special Summoned: You can activate this effect; during the End Phase of this turn, add 1 Dragon monster from your Deck or GY to your hand, except ""Bystial Magnamhut"". You can only use each effect of ""Bystial Magnamhut"" once per turn.",LIGHT/DARK/Dragon,LIGHT/DARK,Adds from Deck to hand/Adds from Graveyard to hand,Ignition/Condition/Trigger/Condition,
60242223,Bystial Saronir,Unlimited(OCG)/Unlimited(TCG),DARK,[Dragon/Effect],,,,,6,2500,2000,,,,"You can target 1 LIGHT or DARK monster in either GY; banish it, and if you do, Special Summon this card from your hand. This is a Quick Effect if your opponent controls a monster. If this card is sent to the GY: You can send 1 ""Bystial"" monster or 1 ""Branded"" Spell/Trap from your Deck to the GY, except ""Bystial Saronir"". You can only use each effect of ""Bystial Saronir"" once per turn.",Supports archetypes /Bystial/Branded,LIGHT/DARK,Sends from Deck to Graveyard,Ignition/Condition/Trigger/Condition,
06637331,Bystial Druiswurm,Limited(OCG)/Limited(TCG),DARK,[Dragon/Effect],,,,,6,2500,2000,,,,"You can target 1 LIGHT or DARK monster in either GY; banish it, and if you do, Special Summon this card from your hand. This is a Quick Effect if your opponent controls a monster. If this card is sent from the field to the GY: You can target 1 Special Summoned monster your opponent controls; send it to the GY. You can only use each effect of ""Bystial Druiswurm"" once per turn.",LIGHT/DARK,LIGHT/DARK,,Ignition/Condition/Trigger/Condition,
