Passcode,Name,Status,Attribute,type,link,link_arrows,rank,pendulum_scale,level,attack,defense,spell_attribute,summoning_condition,pendulum_condition,card_text,card_supports,card_anti_supports,card_actions,effect_types,
34813545,Bénédiction Naturia,Unlimited(OCG)/Unlimited(TCG),MAGIE,,,,,,,,,,,,"Activez 1 de ces effets ;●Invoquez Spécialement 1 monstre ""Naturia"" depuis votre main ou Cimetière.●Immédiatement après la résolution de cet effet, Invoquez par Synchronisation 1 Monstre Synchro, en utilisant des monstres que vous contrôlez (un monstre ""Naturia"" inclus) comme Matériel.●Invoquez par Fusion 1 Monstre Fusion depuis votre Extra Deck, en utilisant des monstres que vous contrôlez comme Matériel (un monstre ""Naturia"" inclus).",Supports archetypes /Naturia,,Uses cards on the field as Synchro Materials/Uses cards on the player's field as Fusion Materials,Effect,
06589707,Terreurs dans la Cité Cachée,Unlimited(OCG)/Unlimited(TCG),MAGIE,,,,,,,,,,,,Votre adversaire ne peut pas cibler les monstres en Position de Défense face verso que vous contrôlez avec des effets de carte. Les monstres que vous contrôlez qui ont été retournés face recto tant que cette carte était face recto sur le Terrain gagnent 1500 ATK/DEF. Si cette carte dans la Zone Magie & Piège de son propriétaire est détruite par un effet de carte de l'adversaire : vous pouvez cibler 1 monstre dans votre Cimetière ; Invoquez-le Spécialement en Position de Défense face verso.,,,,Continuous-like/Continuous-like/Trigger-like,
69973414,Aile Noire - Ombre Jumelle,Unlimited(OCG)/Unlimited(TCG),PIÈGE,,,,,,,,,,,,"Mélangez 2 de vos monstres ""Aile Noire"" (1 Syntoniseur et 1 non-Syntoniseur) qui sont bannis et/ou dans votre Cimetière dans le Deck/Extra Deck ; Invoquez Spécialement 1 ""Dragon Ailes Sombres"" ou Monstre Synchro ""Aile Noire"" depuis votre Extra Deck dont le Niveau est égal à la somme des Niveaux de ces 2 monstres. (Ceci est traité comme une Invocation Synchro.) Si vous contrôlez min. 2 monstres ""Aile Noire"", vous pouvez activer cette carte depuis votre main. Vous ne pouvez activer qu'1 ""Aile Noire - Ombre Jumelle"" par tour.",Supports archetypes /Blackwing,,,Effect/Condition/Condition,
96367119,Bourrasque de l'Ombre Noire,Unlimited(OCG)/Unlimited(TCG),PIÈGE,,,,,,,,,,,,"Lorsqu'une Carte Magie/Piège est activée : retirez 1 Compteur Plumes Noires depuis votre Terrain ; annulez l'activation, et si vous le faites, détruisez la carte. Si vous contrôlez ""Dragon Ailes Sombres"" : vous pouvez Poser cette carte depuis votre Cimetière, mais bannissez-la lorsqu'elle quitte le Terrain. Vous ne pouvez utiliser qu'1 effet de ""Bourrasque de l'Ombre Noire"" par tour, et uniquement une fois le tour.",Black-Winged Dragon,,,Activation requirement/Cost/Effect/Quick-like/Condition,
32756828,Bête du Marqué,Unlimited(OCG)/Unlimited(TCG),PIÈGE,,,,,,,,,,,,"Une fois par tour, durant la Main Phase, si vous contrôlez un monstre ""Bystial"" : vous pouvez Sacrifier 1 monstre Dragon, puis ciblez 1 carte contrôlée par votre adversaire ; détruisez-la. Durant la End Phase : vous pouvez cibler 1 Magie Continue/Piège Continu ""Marqué"" dans votre Cimetière ; placez-le face recto sur votre Terrain. Vous ne pouvez utiliser cet effet de ""Bête du Marqué"" qu'une fois par tour.",Supports archetypes /Branded/Bystial,,Tributes for cost/Places cards from Graveyard in Spell & Trap Zone,Quick-like/Quick-like/Condition,
95245571,Scie Jumelle Griffrayeur,Unlimited(OCG)/Unlimited(TCG),PIÈGE,,,,,,,,,,,,"Sacrifiez 1 monstre ""Griffrayeur"", puis ciblez 2 cartes contrôlées par votre adversaire ; détruisez-les, et si vous le faites, si vous contrôlez ""Visas Starfrost"", bannissez ces cartes détruites au lieu de les envoyer au Cimetière. Si un monstre de min. Link-3 est sur le Terrain : vous pouvez bannir cette carte depuis votre Cimetière ; le reste de ce tour, aucun joueur ne peut activer les effets des Monstres Lien sur le Terrain. Vous ne pouvez activer qu'1 ""Scie Jumelle Griffrayeur"" par tour.",Supports archetypes /Scareclaw,Link Monster,Tributes for cost,Effect/Quick-like/Condition,
68038375,Art Ninjitsu des Feuilles Dansantes,Unlimited(OCG)/Unlimited(TCG),PIÈGE,,,,,,,,,,,,"Activez cette carte en ciblant 1 monstre ""Ninja"" ou 1 monstre en Position de Défense face verso sur le Terrain ; Sacrifiez-le, et si vous le faites, Invoquez Spécialement 1 monstre ""Ninja"" depuis votre Deck. Lorsque cette carte quitte le Terrain, envoyez le monstre au Cimetière. Vous pouvez cibler 1 Magie Continue/Piège Continu ""Ninjitsu"" ou ""Nin-Jitsu"" dans votre Zone Magie & Piège ; renvoyez-le à la main. Vous ne pouvez utiliser qu'1 effet de ""Art Ninjitsu des Feuilles Dansantes"" par tour, et uniquement une fois le tour.",Supports archetypes /Ninjitsu Art/Ninja,,Tributes for cost/Activates when it leaves the field/Sends from field to Graveyard/Returns from field to hand,Effect/Continuous-like/Quick-like/Condition,
20417688,Alignement d'Étoiles dans la Voie Lactée,Unlimited(OCG)/Unlimited(TCG),PIÈGE,,,,,,,,,,,,"Révélez 1 Monstre Rituel dans votre main ; ajoutez 1 Monstre Rituel du même Niveau mais de nom différent depuis votre Deck à votre main. Vous pouvez bannir cette carte depuis votre Cimetière et envoyer 1 Magie Rituelle depuis votre main au Cimetière ; cet effet devient l'effet de la carte qui Invoque Rituellement un monstre lorsque la carte est activée. Vous ne pouvez utiliser chaque effet de ""Alignement d'Étoiles dans la Voie Lactée"" qu'une fois par tour.",Ritual Monster/Ritual Spell Card,,Adds from Deck to hand/Sends from your hand to your Graveyard,Effect/Quick-like/Condition,
67906797,Le Grand Renversement de Nouilles,Unlimited(OCG)/Unlimited(TCG),PIÈGE,,,,,,,,,,,,"Ajoutez la carte du dessous de votre Deck à votre main, puis, prenez 1 carte depuis votre Deck, mélangez, et placez la carte au-dessous du Deck.",,,Adds from Deck to hand,Effect,
57511992,Yorishiro de l'Aqua,Unlimited(OCG)/Unlimited(TCG),EAU,[Aqua/Effet],,,,,Niveau 4,700,2000,,,,"Vous pouvez cibler 1 monstre EAU dans votre Cimetière ; appliquez 1 de ces effets, et aussi, vous ne pouvez pas Invoquer Spécialement de monstres (monstres EAU exclus) le reste de ce tour.●(Uniquement si la cible a un Niveau) jusqu'à la End Phase, le Niveau de cette carte et aussi son nom deviennent les mêmes que ceux du monstre.●(Uniquement si ""Umi"" est sur le Terrain) Invoquez Spécialement le monstre en Position de Défense.Vous pouvez bannir cette carte depuis votre Cimetière, puis ciblez 1 ""Umi"" dans votre Cimetière ; ajoutez-le à votre main. Vous ne pouvez utiliser chaque effet de ""Yorishiro de l'Aqua"" qu'une fois par tour.",WATER/Umi,,Adds from Graveyard to hand,Ignition/Ignition/Condition,
97692972,Maîtresse Amazonesse au Fouet d'Or,Unlimited(OCG)/Unlimited(TCG),TERRE,[Guerrier/Pendule／Effet],,,,,Niveau 5,2000,1200,,,,"Si cette carte dans la Zone Monstre est détruite au combat ou par un effet de carte : vous pouvez placer cette carte dans votre Zone Pendule. Si un ou plusieurs monstres ""Amazonesse"" sont Invoqués Spécialement sur votre Terrain, tant que cette carte est dans votre Cimetière (sauf durant la Damage Step) : vous pouvez placer cette carte dans votre Zone Pendule. Vous ne pouvez utiliser chaque effet de ""Maîtresse Amazonesse au Fouet d'Or"" qu'une fois par tour.",Supports archetypes /Amazoness,,,,
24087580,Maîtresse Amazonesse à l'Épée d'Argent,Unlimited(OCG)/Unlimited(TCG),TERRE,[Guerrier/Pendule／Effet],,,,,Niveau 3,1200,2000,,,,"Si cette carte dans la Zone Monstre est détruite au combat ou par un effet de carte : vous pouvez placer cette carte dans votre Zone Pendule. Si un ou plusieurs monstres ""Amazonesse"" sont Invoqués Spécialement sur votre Terrain, tant que cette carte est dans votre Cimetière (sauf durant la Damage Step) : vous pouvez placer cette carte dans votre Zone Pendule. Vous ne pouvez utiliser chaque effet de ""Maîtresse Amazonesse à l'Épée d'Argent"" qu'une fois par tour.",Supports archetypes /Amazoness,,Adds from Graveyard to hand/Goes to Pendulum Zone,,
50486289,Cheffe de Guerre Amazonesse,Unlimited(OCG)/Unlimited(TCG),TERRE,[Guerrier/Effet],,,,,Niveau 5,1900,0,,,,"Si vous ne contrôlez aucun monstre, ou uniquement des monstres ""Amazonesse"" : vous pouvez Invoquer Spécialement cette carte depuis votre main. Si cette carte est Invoquée Normalement ou Spécialement : vous pouvez Poser 1 Magie/Piège ""Amazonesse"" ou 1 ""Polymérisation"" directement depuis votre Deck, et aussi, vous ne pouvez attaquer qu'avec des monstres ""Amazonesse"" le reste de ce tour. Vous ne pouvez utiliser chaque effet de ""Cheffe de Guerre Amazonesse"" qu'une fois par tour.",Supports archetypes /Amazoness,,Activates from your hand/Sets from your Deck/Prevents attacks,Ignition/Trigger/Condition,
86758746,Arts Secrets Amazonesse,Unlimited(OCG)/Unlimited(TCG),MAGIE,,,,,,,,,,,,"Invoquez par Fusion 1 Monstre Fusion ""Amazonesse"" depuis votre Extra Deck, en utilisant des monstres depuis votre main ou Terrain comme Matériel Fusion. Durant votre Main Phase : vous pouvez bannir cette carte depuis votre Cimetière ; une fois, si vous Invoquez par Fusion un Monstre Fusion ""Amazonesse"" ce tour, vous pouvez aussi envoyer 1 monstre ""Amazonesse"" depuis votre Extra Deck au Cimetière comme Matériel. Vous ne pouvez utiliser qu'1 effet de ""Arts Secrets Amazonesse"" par tour, et uniquement une fois le tour.",Supports archetypes /Amazoness,,Uses cards on the player's field as Fusion Materials/Uses cards in the hand as Fusion Materials/Uses cards in the player's Extra Deck as Fusion Materials,Effect/Ignition-like/Condition,
02347656,Adorable Labrynth du Château d'Argent,Unlimited(OCG)/Unlimited(TCG),TÉNÈBRES,[Démon/Effet],,,,,Niveau 8,2900,1900,,,,"Votre adversaire ne peut pas activer d'effets de monstre en réponse à l'activation de vos Cartes Piège Normal. Vous ne pouvez utiliser chacun des effets suivants de ""Adorable Labrynth du Château d'Argent"" qu'une fois par tour. Vous pouvez cibler 1 Piège Normal dans votre Cimetière ; Posez-le sur votre Terrain, mais il ne peut pas être activé sauf si vous contrôlez un monstre Démon. Si un ou plusieurs autres monstres quittent le Terrain par votre effet de Piège Normal (sauf durant la Damage Step) : vous pouvez détruire 1 carte dans la main de votre adversaire (au hasard) ou sur son Terrain.",Normal Trap Card/Fiend,,Sets from your Graveyard,Continuous/Condition/Ignition/Trigger,
75730490,Ariane la Domestique Labrynth,Unlimited(OCG)/Unlimited(TCG),TÉNÈBRES,[Démon/Effet],,,,,Niveau 4,1800,1100,,,,"Vous pouvez envoyer 1 Piège Normal depuis votre main ou qui est Posé sur votre Terrain au Cimetière ; Invoquez Spécialement 1 monstre Démon de max. Niveau 4 (""Ariane la Domestique Labrynth"" exclu) depuis votre Deck en Position de Défense. Si un ou plusieurs autres monstres quittent le Terrain par votre effet de Piège Normal (sauf durant la Damage Step) : vous pouvez piocher 1 carte, puis vous pouvez appliquer cet effet.●Depuis votre main, soit Invoquez Spécialement 1 monstre Démon, soit Posez 1 Magie/Piège.Vous ne pouvez utiliser chaque effet de ""Ariane la Domestique Labrynth"" qu'une fois par tour.",Normal Trap Card/Fiend,,Sends from hand to Graveyard for cost/Sends from field to Graveyard for cost/Activates if other cards leave the field/You draw cards/Sets from your hand,Ignition/Trigger/Condition,
01225009,Arianna la Domestique Labrynth,Unlimited(OCG)/Unlimited(TCG),TÉNÈBRES,[Démon/Effet],,,,,Niveau 4,1600,2100,,,,"Si cette carte est Invoquée Normalement ou Spécialement : vous pouvez ajouter 1 carte ""Labrynth"" (""Arianna la Domestique Labrynth"" exclu) depuis votre Deck à votre main. Si un ou plusieurs autres monstres quittent le Terrain par votre effet de Piège Normal (sauf durant la Damage Step) : vous pouvez piocher 1 carte, puis vous pouvez appliquer cet effet.●Depuis votre main, soit Invoquez Spécialement 1 monstre Démon, soit Posez 1 Magie/Piège.Vous ne pouvez utiliser qu'1 effet de ""Arianna la Domestique Labrynth"" par tour, et uniquement une fois le tour.",Supports archetypes /Labrynth,,Activates upon Normal Summon/Activates upon Special Summon/Adds from Deck to hand/Activates when other cards leave the field/You draw cards/Sets from your hand,Trigger/Condition,
74018812,Cheminie Torbie Labrynth,Unlimited(OCG)/Unlimited(TCG),TÉNÈBRES,[Démon/Effet],,,,,Niveau 2,0,2000,,,,"(Effet Rapide) : vous pouvez envoyer cette carte depuis votre main ou Terrain au Cimetière, et défaussez 1 carte ; Posez 1 Magie/Piège ""Labrynth"" depuis votre main ou Deck. Si un ou plusieurs monstres quittent le Terrain par votre effet de Piège Normal, tant que cette carte est dans votre Cimetière (sauf durant la Damage Step) : vous pouvez Invoquer Spécialement cette carte. Vous ne pouvez utiliser chaque effet de ""Cheminie Torbie Labrynth"" qu'une fois par tour.",Supports archetypes /Labrynth,,Activates from your hand/Sends itself from hand to Graveyard for cost/Sends itself from field to Graveyard for cost/Discards for cost/Sets from your hand/Sets from your Deck/Activates if other cards leave the field/Activates from your Graveyard,Quick/Trigger/Condition,
00002511,Penducoucou Labrynth,Unlimited(OCG)/Unlimited(TCG),TÉNÈBRES,[Démon/Effet],,,,,Niveau 1,0,0,,,,"(Effet Rapide) : vous pouvez défausser cette carte ; ce tour, vous pouvez activer 1 Carte Piège Normal qui a été Posée ce tour, si vous contrôlez un monstre ""Labrynth"". Si une ou plusieurs cartes sont envoyées depuis votre main au Cimetière pour activer votre Carte Piège Normal ou votre carte ou effet ""Labrynth"" (""Penducoucou Labrynth"" exclu), tant que cette carte est dans votre Cimetière (sauf durant la Damage Step) : vous pouvez ajouter cette carte à votre main, ou l'Invoquer Spécialement. Vous ne pouvez utiliser chaque effet de ""Penducoucou Labrynth"" qu'une fois par tour.",Supports archetypes /Labrynth,,Special Summons itself from your Graveyard/Returns itself from Graveyard to hand,Quick/Trigger/Condition,
69895264,Traquenard Labrynth,Unlimited(OCG)/Unlimited(TCG),MAGIE,,,,,,,,,,,,"Ciblez 2 de vos Magies/Pièges ""Labrynth"" (""Traquenard Labrynth"" exclu) qui sont bannis ou dans votre Cimetière ; mélangez-les dans le Deck, puis si vous contrôlez un monstre Démon, vous pouvez Poser un nombre de Pièges Normaux non-""Labrynth"" de noms différents directement depuis votre Deck, égal au nombre mélangé. Vous ne pouvez activer qu'1 ""Traquenard Labrynth"" par tour.",Supports archetypes /Labrynth,,,Effect/Condition,
05380979,Bienvenue Labrynth,Unlimited(OCG)/Unlimited(TCG),PIÈGE,,,,,,,,,,,,"Invoquez Spécialement 1 monstre ""Labrynth"" depuis votre Deck, et aussi, jusqu'à la fin du prochain tour après la résolution de cette carte, vous ne pouvez pas Invoquer Spécialement de monstres (monstres Démon exclus) depuis le Deck ou Extra Deck. Si un monstre quitte le Terrain par votre effet de Piège Normal, tant que cette carte est dans votre Cimetière, sauf le tour où elle y a été envoyée : vous pouvez Poser cette carte. Vous ne pouvez utiliser chaque effet de ""Bienvenue Labrynth"" qu'une fois par tour.",Supports archetypes /Labrynth,,Activates when other cards leave the field/Activates from your Graveyard/Sets itself from your Graveyard,Effect/Trigger-like/Condition,
32785578,Adieubienvenue Labrynth,Unlimited(OCG)/Unlimited(TCG),PIÈGE,,,,,,,,,,,,"Lorsqu'un monstre déclare une attaque, tant que vous contrôlez un monstre Démon : ciblez 1 carte sur le Terrain ; annulez l'attaque, et si vous le faites, détruisez la carte ciblée, puis, vous pouvez Poser 1 Piège Normal non-""Labrynth"" depuis votre main ou Deck.",Fiend/Normal Trap Card,,Sets from your hand/Sets from your Deck,Effect,
68779682,Déferlement Labrynth,Unlimited(OCG)/Unlimited(TCG),PIÈGE,,,,,,,,,,,,"Lorsque vous activez une Carte Piège Normal Posée (""Déferlement Labrynth"" exclu) : cet effet devient l'effet du Piège Normal lorsque la carte est activée, et aussi, jusqu'à la fin du prochain tour de votre adversaire après la résolution de cette carte, votre adversaire ne reçoit aucun dommage d'effet de vos effets de carte.",Normal Trap Card,,,Effect,
05168381,Effroyable Ruse de l'Archdémon,Unlimited(OCG)/Unlimited(TCG),PIÈGE,,,,,,,,,,,,"Si vous contrôlez un monstre Démon : ciblez 1 carte sur le Terrain ; détruisez-la, puis, vous pouvez envoyer 1 monstre Démon depuis votre Deck au Cimetière.",Fiend,,Sends from your Deck to your Graveyard,Effect,
92107604,Fontaine Runick,Limited(OCG)/Semi-Limited(TCG),MAGIE,,,,,,,,,,,,"Vous pouvez activer des Cartes Magie Jeu-Rapide ""Runick"" depuis votre main durant le tour de votre adversaire. Une fois par tour, si vous activez une Carte Magie Jeu-Rapide ""Runick"" : vous pouvez cibler max. 3 Magies Jeu-Rapide ""Runick"" dans votre Cimetière ; placez-les au-dessous de votre Deck dans l'ordre de votre choix, puis piochez le même nombre de cartes.",Supports archetypes /Runick,,Allows activation of Spell Cards from the player's hand during the opponent's turn/Places cards from the player's Graveyard on the bottom of the Deck/You draw cards,Continuous-like/Trigger-like,
31562086,Pointe Runick,Unlimited(OCG)/Unlimited(TCG),MAGIE,,,,,,,,,,,,"Activez 1 de ces effets, mais sautez votre prochaine Battle Phase après activation ;●Ajoutez 1 carte ""Runick"" (""Pointe Runick"" exclu) depuis votre Deck à votre main, puis bannissez la carte du dessus du Deck de votre adversaire.●Invoquez Spécialement 1 monstre ""Runick"" depuis votre Extra Deck dans la Zone Monstre Extra.Vous ne pouvez activer qu'1 ""Pointe Runick"" par tour.",Supports archetypes /Runick,,Skips Battle Phase/Adds from Deck to hand,Effect/Condition,
68957034,Feu Étincelant Runick,Unlimited(OCG)/Unlimited(TCG),MAGIE,,,,,,,,,,,,"Activez 1 de ces effets, mais sautez votre prochaine Battle Phase après activation ;●Ciblez 1 monstre Invoqué Spécialement contrôlé par votre adversaire ; détruisez-le, puis bannissez les 2 cartes du dessus du Deck de votre adversaire.●Invoquez Spécialement 1 monstre ""Runick"" depuis votre Extra Deck dans la Zone Monstre Extra.Vous ne pouvez activer qu'1 ""Feu Étincelant Runick"" par tour.",Supports archetypes /Runick,,Skips Battle Phase,Effect/Condition,
94445733,Destruction Runick,Unlimited(OCG)/Unlimited(TCG),MAGIE,,,,,,,,,,,,"Activez 1 de ces effets, mais sautez votre prochaine Battle Phase après activation ;●Ciblez 1 Magie/Piège contrôlé par votre adversaire ; détruisez-le, puis bannissez les 4 cartes du dessus du Deck de votre adversaire.●Invoquez Spécialement 1 monstre ""Runick"" depuis votre Extra Deck dans la Zone Monstre Extra.Vous ne pouvez activer qu'1 ""Destruction Runick"" par tour.",Supports archetypes /Runick,,Skips Battle Phase,Effect/Condition,
93229151,Tempête Cinglante Runick,Unlimited(OCG)/Unlimited(TCG),MAGIE,,,,,,,,,,,,"Activez 1 de ces effets, mais sautez votre prochaine Battle Phase après activation ;●Bannissez un nombre de cartes du dessus du Deck de votre adversaire, inférieur ou égal au nombre de cartes qu'il contrôle.●Invoquez Spécialement 1 monstre ""Runick"" depuis votre Extra Deck dans la Zone Monstre Extra.Vous ne pouvez activer qu'1 ""Tempête Cinglante Runick"" par tour.",Supports archetypes /Runick,,Skips Battle Phase,Effect/Condition,
55990317,Hugin des Ailes Runick,Unlimited(OCG)/Unlimited(TCG),LUMIÈRE,[Elfe/Fusion／Effet],,,,,Niveau 2,0,0,,"2 monstres ""Runick""",,"Si cette carte est Invoquée Spécialement depuis l'Extra Deck : vous pouvez défausser 1 carte ; ajoutez 1 Magie de Terrain ""Runick"" depuis votre Deck à votre main. Si une ou plusieurs autres cartes que vous contrôlez vont être détruites par un effet de carte, vous pouvez bannir cette carte que vous contrôlez à la place. Si cette carte sur le Terrain est détruite au combat ou par un effet de carte : renvoyez cette carte à l'Extra Deck.",Supports archetypes /Runick,,Activates upon Special Summon/Discards for cost/Adds from Deck to hand/Activates if destroyed by battle/Activates if destroyed by card effect/Returns itself from Graveyard to Extra Deck,Trigger/Continuous/Trigger,
92385016,Munin des Ailes Runick,Unlimited(OCG)/Unlimited(TCG),LUMIÈRE,[Elfe/Fusion／Effet],,,,,Niveau 3,0,2000,,"2 monstres ""Runick""",,"Si cette carte est Invoquée Spécialement depuis l'Extra Deck : vous pouvez défausser 1 carte ; ajoutez 1 Magie Continue ""Runick"" depuis votre Deck à votre main. Lorsque votre adversaire active une carte ou un effet qui cible une ou plusieurs cartes ""Runick"" que vous contrôlez ou une ou plusieurs cartes Posées que vous contrôlez (Effet Rapide) : vous pouvez bannir cette carte que vous contrôlez ; annulez l'activation, et si vous le faites, détruisez la carte. Une fois par tour, durant la End Phase : gagnez 1000 LP.",Supports archetypes /Runick,,Activates upon Special Summon/Discards for cost/Adds from Deck to hand,Trigger/Quick/Trigger,
28373620,Geri des Crocs Runick,Unlimited(OCG)/Unlimited(TCG),TÉNÈBRES,[Bête/Fusion／Effet],,,,,Niveau 4,0,1000,,"2 monstres ""Runick""",,"Non destructible par des effets de carte. Si cette carte est Invoquée Spécialement depuis l'Extra Deck : vous pouvez cibler 1 Magie non-Jeu-Rapide ""Runick"" dans votre Cimetière ; ajoutez-la à votre main. Lorsque cette carte est détruite au combat : vous pouvez cibler 1 carte sur le Terrain ; détruisez-la.",Supports archetypes /Runick,,Activates upon Special Summon/Adds from Graveyard to hand/Activates if destroyed by battle,Continuous/Trigger/Trigger,
30802207,Exosœur Carpedivem,Unlimited(OCG)/Unlimited(TCG),MAGIE,,,,,,,,,,,,"Aucun joueur ne peut cibler de monstres ""Exosœur"" que vous contrôlez avec les effets des monstres qui ont été Invoqués Spécialement depuis le Cimetière. Vous ne pouvez utiliser chacun des effets suivants de ""Exosœur Carpedivem"" qu'une fois par tour. Si vous Invoquez par Xyz un monstre ""Exosœur"" : vous pouvez déclarer 1 nom de carte ; jusqu'à la fin de ce tour, annulez les effets activés et les effets sur le Terrain de cartes de ce nom d'origine. Lorsqu'une attaque impliquant votre monstre ""Exosœur"" est déclarée : vous pouvez cibler 1 Magie/Piège contrôlé par votre adversaire ; détruisez-le.",Supports archetypes /Exosister,,,Continuous-like/Condition/Trigger-like/Trigger-like,
03285551,Rite de l'Aramesir,Unlimited(OCG)/Unlimited(TCG),MAGIE,,,,,,,,,,,,"Si vous ne contrôlez aucun ""Jeton Aventurier"" : Invoquez Spécialement 1 ""Jeton Aventurier"" (Elfe/TERRE/Niveau 4/ATK 2000/DEF 2000), puis si vous ne contrôlez pas ""Aventure Fatidique"", vous pouvez placer 1 ""Aventure Fatidique"" depuis votre Deck face recto dans votre Zone Magie & Piège. Vous ne pouvez pas activer les effets des monstres sur le Terrain (ceux des monstres Invoqués Spécialement exclus) le tour où vous activez cette carte. Vous ne pouvez activer qu'1 ""Rite de l'Aramesir"" par tour.",Adventurer Token/Fateful Adventure,,Places cards from Deck in Spell & Trap Zone,Effect/Condition/Condition,
30680659,Enchanteresse de l'Eau du Temple,Unlimited(OCG)/Unlimited(TCG),EAU,[Magicien/Effet],,,,,Niveau 3,1500,1200,,,,"Si vous contrôlez ""Jeton Aventurier"" : vous pouvez Invoquer Spécialement cette carte depuis votre main. Vous pouvez bannir cette carte depuis votre main ou Cimetière ; ajoutez 1 ""Rite de l'Aramesir"" depuis votre Deck ou Cimetière à votre main. Si vous contrôlez ""Jeton Aventurier"" : vous pouvez placer 1 Magie de Terrain qui mentionne ""Jeton Aventurier"" depuis votre Deck face recto dans votre Zone Terrain. Vous ne pouvez utiliser chaque effet de ""Enchanteresse de l'Eau du Temple"" qu'une fois par tour.",Adventurer Token/Rite of Aramesir,,Activates from your hand/Adds from Deck to hand/Adds from Graveyard to hand/Places cards from your Deck in your Field Zone,Ignition/Ignition/Ignition/Condition,
66078354,Guerrier Maginerai des Reliques,Unlimited(OCG)/Unlimited(TCG),FEU,[Guerrier/Effet],,,,,Niveau 4,2300,1000,,,,"Ne peut pas attaquer sauf si vous contrôlez ""Jeton Aventurier"". Vous ne pouvez utiliser chacun des effets suivants de ""Guerrier Maginerai des Reliques"" qu'une fois par tour. Si vous contrôlez ""Jeton Aventurier"" : vous pouvez Invoquer Spécialement cette carte depuis votre main. À la fin de la Battle Phase, si votre monstre qui mentionne ""Jeton Aventurier"" a combattu : vous pouvez Poser 1 Piège qui mentionne ""Jeton Aventurier"" directement depuis votre Deck.",Adventurer Token,,,Continuous/Condition/Ignition/Trigger,
02563463,Cavalier de Gryphon Errant,Limited(OCG)/Unlimited(TCG),VENT,[Bête Ailée/Effet],,,,,Niveau 7,2000,2800,,,,"Durant la Main Phase, si vous ne contrôlez aucun monstre ou contrôlez ""Jeton Aventurier"" (Effet Rapide) : vous pouvez Invoquer Spécialement cette carte depuis votre main. Lorsqu'une carte ou un effet est activé tant que vous contrôlez ""Jeton Aventurier"" (Effet Rapide) : vous pouvez mélanger cette carte dans le Deck, et si vous le faites, annulez l'activation, et si vous faites ça, détruisez la carte. Vous ne pouvez utiliser chaque effet de ""Cavalier de Gryphon Errant"" qu'une fois par tour.",Adventurer Token,,,Quick/Quick/Condition,
