Passcode,Name,Status,Attribute,type,link,link_arrows,rank,pendulum_scale,level,attack,defense,spell_attribute,summoning_condition,pendulum_condition,card_text,card_supports,card_anti_supports,card_actions,effect_types,
14087893,Le Livre de la Lune,Unlimited(OCG)/Unlimited(TCG)/Limited 3(TCGSpeed Duel),MAGIE,,,,,,,,,,,,Ciblez 1 monstre face recto sur le Terrain ; changez la cible en Position de Défense face verso.,,,Flips monsters face-down/Changes battle positions,Effect,
60764581,Agneaux Égarés,Unlimited(OCG)/Unlimited(TCG)/Unlimited(TCGSpeed Duel),MAGIE,,,,,,,,,,,,"Invoquez Spécialement 2 ""Jeton Agneau"" (Bête/TERRE/Niveau 1/ATK 0/DEF 0) en Position de Défense. Vous ne pouvez pas Invoquer d'autres monstres le tour où vous activez cette carte (mais vous pouvez Poser).",,,,Effect/Condition,
67169062,Pot d'Avarice,Unlimited(OCG)/Unlimited(TCG)/Unlimited(TCGSpeed Duel),MAGIE,,,,,,,,,,,,"Ciblez 5 monstres dans votre Cimetière ; mélangez-les tous les 5 dans le Deck, puis piochez 2 cartes.",,,Returns from your Graveyard to your Deck/You draw cards,Effect,
98069388,Corne du Paradis,Unlimited(OCG)/Unlimited(TCG),PIÈGE,,,,,,,,,,,,"Lorsqu'un ou plusieurs monstres vont être Invoqués : Sacrifiez 1 monstre ; annulez l'Invocation, et si vous le faites, détruisez les monstres.",,,Tributes for cost,Activation requirement/Cost/Effect,
01248895,Destruction en Chaîne,Unlimited(OCG)/Unlimited(TCG),PIÈGE,,,,,,,,,,,,Lorsqu'un ou plusieurs monstres avec max. 2000 ATK sont Invoqués : ciblez-en 1 ; détruisez toutes les cartes de ce nom dans la main et Main Deck de son contrôleur.,,,,Activation requirement/Effect,
53582587,Hommage Torrentiel,Unlimited(OCG)/Unlimited(TCG),PIÈGE,,,,,,,,,,,,Lorsqu'un ou plusieurs monstres sont Invoqués : détruisez tous les monstres sur le Terrain.,,,,Activation requirement/Effect,
94192409,Dispositif d'Évacuation Obligatoire,Unlimited(OCG)/Unlimited(TCG),PIÈGE,,,,,,,,,,,,Ciblez 1 monstre sur le Terrain ; renvoyez la cible à la main.,,,Returns from field to hand,Effect,
50323155,Corne Céleste Ténébreuse,Unlimited(OCG)/Unlimited(TCG),PIÈGE,,,,,,,,,,,,"Lorsque votre adversaire va Invoquer Spécialement exactement 1 monstre : annulez l'Invocation Spéciale, et si vous le faites, détruisez-le.",,,,Activation requirement/Effect,
30459350,Mur de Fer Impérial,Unlimited(OCG)/Unlimited(TCG),PIÈGE,,,,,,,,,,,,Aucun joueur ne peut bannir de cartes.,,,,Continuous-like,
