Passcode,Name,Status,Attribute,type,link,link_arrows,rank,pendulum_scale,level,attack,defense,spell_attribute,summoning_condition,pendulum_condition,card_text,card_supports,card_anti_supports,card_actions,effect_types,
10485110,Seigneur Dragon Océan - Néo-Dédale,Unlimited(OCG)/Unlimited(TCG),EAU,[Serpent de Mer/Effet],,,,,Niveau 8,2900,1600,,,,"Cette carte ne peut ni être Invoquée par Invocation Normale ni être Posée. Cette carte ne peut être Invoquée par Invocation Spéciale excépté en sacrifiant 1 ""Dragon-Levia - Dédale"" sur votre Terrain. Envoyez ""Umi"" de votre Terrain au Cimetière pour envoyer au Cimetière toutes les cartes dans la main des deux joueurs et sur le Terrain excepté cette carte.",Umi/Levia-Dragon - Daedalus,,Tributes for cost/Sends from field to Graveyard for cost/Sends from field to Graveyard/Sends from hand to Graveyard,Summon/Ignition,
23771716,Poisson aux 7 Couleurs,Unlimited(OCG)/Unlimited(TCG)/Unlimited(TCGSpeed Duel),EAU,[Poisson/Normal],,,,,Niveau 4,1800,800,,,,Aucun mortel n'a jamais réussi à capturer ce poisson arc-en-ciel très rare.,,,,,
42071342,Guerrier Serpent de Mer des Ténèbres,Unlimited(OCG)/Unlimited(TCG),EAU,[Serpent de Mer/Normal],,,,,Niveau 4,1800,1500,,,,"Un guerrier qui défend le monde de la Mer des Ténèbres. Il s'enorgueillit de ses prouesses au combat, tant sur la terre que dans l'eau.",,,,,
36119641,Poisson-Lune Spatial,Unlimited(OCG)/Unlimited(TCG),EAU,[Poisson/Normal],,,,,Niveau 4,1700,1000,,,,Un poisson-lune spatial flottant dans l'univers infini. On dit que ce fossile vivant est la résurgence d'une ancienne civilisation d'Alphard4.,,,,,
57839750,Mère Grizzly,Unlimited(OCG)/Unlimited(TCG)/Unlimited(TCGSpeed Duel),EAU,[Bête-Guerrier/Effet],,,,,Niveau 4,1400,1000,,,,Lorsque cette carte est détruite au combat et envoyée au Cimetière : vous pouvez Invoquer Spécialement 1 monstre EAU avec max. 1500 ATK depuis votre Deck en Position d'Attaque.,WATER,,Activates from your Graveyard,Trigger,
33184167,Génovirus,Unlimited(OCG)/Unlimited(TCG)/Limited 3(TCGSpeed Duel),EAU,[Aqua/Effet],,,,,Niveau 4,1600,1000,,,,Défaussez 1 carte de votre main et déclarez 1 Type de monstre. Détruisez tous les monstres face recto du Type déclaré sur le Terrain.,,,Discards for cost/Declares a Type,Ignition,
00218704,Fenrir,Unlimited(OCG)/Unlimited(TCG),WATER,[Beast/Effect],,,,,4,1400,1200,,,,"This card cannot be Normal Summoned or Set. This card can only be Special Summoned by removing 2 WATER monsters in your Graveyard from play. When this card destroys an opponent's monster as a result of battle, your opponent skips his/her next Draw Phase.",WATER,,Activates when it destroys a monster by battle/Skips Draw Phase,Summon/Trigger,
64342551,Bugroth Amphibie MK-3,Unlimited(OCG)/Unlimited(TCG),EAU,[Machine/Effet],,,,,Niveau 4,1500,1300,,,,"Tant qu' ""Umi"" reste face recto sur le Terrain, cette carte peut attaquer directement les Life Points de votre adversaire.",Umi,,,Continuous,
24435369,Chevalier Sirène,Unlimited(OCG)/Unlimited(TCG),EAU,[Aqua/Effet],,,,,Niveau 4,1500,700,,,,"Tant que ""Umi"" reste face recto sur le Terrain, cette carte peut attaquer 2 fois durant la même Battle Phase.",Umi,,,Continuous,
04929256,Mobius le Monarque de Glace,,EAU,[Aqua/Effet],,,,,Niveau 6,2400,1000,,,,Lorsque cette carte est Invoquée par Sacrifice : vous pouvez cibler max. 2 Magies/Pièges sur le Terrain ; détruisez les cibles.,,,Activates upon Tribute Summon,Trigger,
52571838,Manta de la Malediction Rampante,Unlimited(OCG)/Unlimited(TCG),EAU,[Poisson/Effet],,,,,Niveau 3,1300,1200,,,,"Lorsque cette carte est Invoquée par Invocation Normale avec succès, aucune Carte Piège ne peut être activée.",,,,Continuous,
45986603,Vol à l'Arraché,Unlimited(OCG)/Limited(TCG),MAGIE,,,,,,,,,,,,"Équipable uniquement à un monstre contrôlé par votre adversaire. Prenez le contrôle du monstre équipé. Une fois par tour, durant la Standby Phase de votre adversaire : il gagne 1000 LP.",,,Takes control of equipped,Condition/Continuous-like/Trigger-like,
05318639,Typhon d'Espace Mystique,Unlimited(OCG)/Unlimited(TCG)/Limited 1(TCGSpeed Duel),MAGIE,,,,,,,,,,,,Ciblez 1 Magie/Piège sur le Terrain ; détruisez la cible.,,,,Effect,
55144522,Pot de Cupidité,Forbidden(OCG)/Forbidden(TCG),MAGIE,,,,,,,,,,,,Piochez 2 cartes.,,,You draw cards,Effect,
19613556,Violent Orage,Limited(OCG)/Forbidden(TCG),MAGIE,,,,,,,,,,,,Détruisez toutes les Cartes Magie/Piège sur le Terrain.,,,,Effect,
00295517,Océan Légendaire,Unlimited(OCG)/Unlimited(TCG)/Unlimited(TCGSpeed Duel),MAGIE,,,,,,,,,,,,"(Cette carte est toujours traitée comme ""Umi"".)Tous les monstres EAU sur le Terrain gagnent 200 ATK/DEF. Réduisez le Niveau de tous les monstres EAU dans la main de chaque joueur et sur le Terrain de 1.",WATER,,,Condition/Continuous-like,
31036355,Permutation de Créature,Unlimited(OCG)/Unlimited(TCG)/Unlimited(TCGSpeed Duel),MAGIE,,,,,,,,,,,,"Chaque joueur choisit 1 monstre qu'il contrôle et échange son contrôle avec celui choisi par l'adversaire. Le reste de ce tour, ces monstres ne peuvent pas changer de position de combat.",,,Changes control/Prevents Battle Position changes,Effect/Condition,
51562916,Déferlante et Vaguelette,Unlimited(OCG)/Unlimited(TCG)/Unlimited(TCGSpeed Duel),MAGIE,,,,,,,,,,,,"Détruisez autant de monstres EAU que vous contrôlez que possible, puis vous pouvez Invoquer Spécialement un nombre de monstres EAU depuis votre main, inférieur ou égal au nombre de monstres détruits par cet effet.",WATER,,,Effect,
60082869,Tornade de Poussière,Unlimited(OCG)/Unlimited(TCG)/Unlimited(TCGSpeed Duel),PIÈGE,,,,,,,,,,,,"Ciblez 1 Magie/Piège contrôlé par votre adversaire ; détruisez la cible, puis vous pouvez Poser 1 Magie/Piège depuis votre main.",,,Sets from your hand,Effect,
97077563,Appel de l'Être Hanté,Unlimited(OCG)/Unlimited(TCG),PIÈGE,,,,,,,,,,,,"Activez cette carte en ciblant 1 monstre dans votre Cimetière ; Invoquez Spécialement la cible en Position d'Attaque. Lorsque cette carte quitte le Terrain, détruisez le monstre. Lorsque le monstre est détruit, détruisez cette carte.",,,,Effect/Continuous-like,
85742772,Filet Gravitationnel,Unlimited(OCG)/Unlimited(TCG),PIÈGE,,,,,,,,,,,,Les monstres de min. Niveau 4 ne peuvent pas attaquer.,,,,Continuous-like,
18605135,Mur Tornade,Unlimited(OCG)/Unlimited(TCG)/Unlimited(TCGSpeed Duel),PIÈGE,,,,,,,,,,,,"Activez uniquement si ""Umi"" est sur le Terrain. Tant que ""Umi"" est sur le Terrain, vous ne recevez aucun dommage de combat. Si ""Umi"" n'est pas sur le Terrain, détruisez cette carte.",Umi,,,Activation requirement/Continuous-like,
53582587,Hommage Torrentiel,Unlimited(OCG)/Unlimited(TCG),PIÈGE,,,,,,,,,,,,Lorsqu'un ou plusieurs monstres sont Invoqués : détruisez tous les monstres sur le Terrain.,,,,Activation requirement/Effect,
38275183,Sort de Bouclier Type 8,Unlimited(OCG)/Unlimited(TCG),PIÈGE,,,,,,,,,,,,"Activez 1 de ces effets. ●Lorsqu'une Carte Magie qui cible exactement 1 monstre sur le Terrain est activée : annulez l'activation, et si vous le faites, détruisez-la. ●Lorsqu'une Carte Magie est activée : envoyez 1 Carte Magie depuis votre main au Cimetière ; annulez l'activation, et si vous le faites, détruisez-la.",,,Sends from your hand to your Graveyard for cost,Activation requirement/Effect/Cost,
76515293,Xing Zhen Hu,Unlimited(OCG)/Unlimited(TCG),TRAP,,,,,,,,,Continuous,,,Activate by selecting 2 Set Spell or Trap Cards on the field. The selected Spell or Trap Cards cannot be activated.,,,,Continuous-like,
