Passcode,Name,Status,Attribute,type,link,link_arrows,rank,pendulum_scale,level,attack,defense,spell_attribute,summoning_condition,pendulum_condition,card_text,card_supports,card_anti_supports,card_actions,effect_types,
10613952,Chevalier Noble Sacré d'Artorigus le Roi,Unlimited(OCG)/Unlimited(TCG),LUMIÈRE,[Guerrier/Xyz／Effet],,,Rang 5,,,2200,2200,,"2 monstres ""Chevalier Noble"" de Niveau 5",,"Lorsque cette carte est Invoquée par Xyz : vous pouvez cibler max. 3 Cartes Magie d'Équipement ""Armes Nobles"" de noms différents dans votre Cimetière ; équipez les cibles à cette carte. Une fois par tour : vous pouvez détacher 1 Matériel Xyz de cette carte, puis ciblez 1 autre monstre sur le Terrain ; détruisez la cible. Si cette carte est envoyée depuis le Terrain au Cimetière : vous pouvez cibler 1 monstre ""Chevalier Noble"" de min. Niveau 4 dans votre Cimetière ; Invoquez Spécialement la cible.",Supports archetypes /Noble Knight/Noble Arms,,Activates upon Xyz Summon/Places cards from Graveyard in Spell & Trap Zone,Trigger/Ignition,
72497366,Sinistre Yorishiro,Unlimited(OCG)/Unlimited(TCG),PIÈGE,,,,,,,,,,,,"Chaque tour, 1 monstre Démon de min. Niveau 5 que vous Invoquez Normalement peut être Invoqué sans Sacrifice. Si exactement 1 monstre Démon de min. Niveau 5 Invoqué/Posé Normalement (et aucune autre carte) va être détruit, vous pouvez envoyer cette carte au Cimetière à la place.",Fiend,,Sends itself from field to Graveyard,Continuous-like,
60181553,Mira le Porteur d'Étoiles,Unlimited(OCG)/Unlimited(TCG),LUMIÈRE,[Guerrier/Xyz／Effet],,,Rang 1,,,1100,1000,,3 monstres de Niveau 1,,"Si cette carte face recto va être détruite, vous pouvez détacher 1 Matériel Xyz de cette carte à la place. Les monstres de max. Niveau 4 que vous contrôlez ne peuvent pas être détruits par des effets de carte.",,,Detaches Xyz Materials for effect,Continuous,
25407643,Sanctuaire Secret des Sorciers (Actualisé de : Sanctuaire Secret des Magiciens),Unlimited(OCG)/Unlimited(TCG),MAGIE,,,,,,,,,,,,"Lorsqu'un ou plusieurs monstres (monstres de Type Magicien exclus) sont Invoqués Normalement ou Spécialement sur le Terrain de votre adversaire tant que vous contrôlez une autre Carte Magie face recto et que votre adversaire ne contrôle aucune Carte Magie face recto : ce tour, le monstre ne peut ni attaquer ni activer ses effets. (Ceci est valide même si cette carte quitte le Terrain.) Si vous ne contrôlez aucun monstre de Type Magicien, détruisez cette carte.",Spellcaster,,Activates upon Normal Summon/Activates upon Special Summon,Trigger-like/Continuous-like,
61901281,Dragon Noir Effonserpent,Unlimited(OCG)/Semi-Limited(TCG),TÉNÈBRES,[Dragon/Effet],,,,,Niveau 4,1800,1700,,,,"Ni Invocable Normalement ni Posable Normalement. Uniquement Invocable Spécialement (depuis votre main) en bannissant 1 monstre LUMIÈRE depuis votre Cimetière. Vous ne pouvez Invoquer Spécialement ""Dragon Noir Effonserpent"" qu'une fois par tour de cette façon. Si cette carte est envoyée depuis le Terrain au Cimetière : vous pouvez ajouter 1 ""Dragon Blanc Destruvouivre"" depuis votre Deck à votre main.",LIGHT/White Dragon Wyverburster,,Adds from Deck to hand,Summon/Condition/Trigger,
50789693,Kappa Cuirassé,Unlimited(OCG)/Unlimited(TCG),EAU,[Psychique/Xyz／Effet],,,Rang 2,,,400,1000,,2 monstres de Niveau 2,,"Une fois par tour : vous pouvez détacher 1 Matériel Xyz de cette carte ; cette carte gagne 1000 ATK ou DEF. Durant la Battle Step de chaque joueur, tant qu'une attaque impliquant votre monstre a lieu : vous pouvez défausser 1 carte ; le reste de ce tour, les monstres que vous contrôlez ne peuvent pas être détruits au combat, et aussi, vous ne recevez aucun dommage de combat. Vous ne pouvez utiliser cet effet de ""Kappa Cuirassé"" qu'une fois par Duel.",,,Discards for cost,Ignition/Quick/Condition,
