Passcode,Name,Status,Attribute,type,link,link_arrows,rank,pendulum_scale,level,attack,defense,spell_attribute,summoning_condition,pendulum_condition,card_text,card_supports,card_anti_supports,card_actions,effect_types,
62957424,"Libic, Malebranche des Abysses Ardents",Unlimited(OCG)/Unlimited(TCG),TÉNÈBRES,[Démon/Effet],,,,,Niveau 3,1300,700,,,,"Si vous contrôlez un monstre (monstres ""Abysses Ardents"" exclus), détruisez cette carte. Vous ne pouvez utiliser qu'1 de ces effets de ""Libic, Malebranche des Abysses Ardents"" par tour, et uniquement une fois le tour.●Si vous ne contrôlez aucune Carte Magie/Piège : vous pouvez Invoquer Spécialement cette carte depuis votre main.●Si cette carte est envoyée au Cimetière : vous pouvez Invoquer Spécialement 1 monstre TÉNÈBRES de Type Démon de Niveau 3 depuis votre main, mais ses effets sont annulés.",Supports archetypes /Burning Abyss,,Activates from your hand/Activates from your Graveyard,Continuous/Condition/Ignition/Trigger,
09342162,"Cagna, Malebranche des Abysses Ardents",Unlimited(OCG)/Unlimited(TCG),TÉNÈBRES,[Démon/Effet],,,,,Niveau 3,1500,300,,,,"Si vous contrôlez un monstre (monstres ""Abysses Ardents"" exclus), détruisez cette carte. Vous ne pouvez utiliser qu'1 de ces effets de ""Cagna, Malebranche des Abysses Ardents"" par tour, et uniquement une fois le tour.●Si vous ne contrôlez aucune Carte Magie/Piège : vous pouvez Invoquer Spécialement cette carte depuis votre main.●Si cette carte est envoyée au Cimetière : vous pouvez envoyer 1 Carte Magie/Piège ""Abysses Ardents"" depuis votre Deck au Cimetière.",Supports archetypes /Burning Abyss,,Activates from your Graveyard/Sends from your Deck to your Graveyard,Continuous/Condition/Ignition/Trigger,
35330871,"Malacoda, Seigneur des Enfers des Abysses Ardents",Unlimited(OCG)/Unlimited(TCG),TÉNÈBRES,[Démon/Rituel／Effet],,,,,Niveau 6,2700,2200,,,,"Vous pouvez Invoquer Rituellement cette carte avec ""Bien et Mal des Abysses Ardents"". Uniquement Invocable Rituellement et non Invocable Spécialement autrement. Une fois par tour, durant le tour de chaque joueur : vous pouvez envoyer 1 monstre ""Abysses Ardents"" depuis votre main au Cimetière, puis ciblez 1 monstre face recto contrôlé par votre adversaire ; jusqu'à la fin de ce tour, la cible perd une ATK/DEF égales à l'ATK/DEF du monstre ""Abysses Ardents"" envoyé au Cimetière de cette façon. Si cette carte est envoyée depuis le Terrain au Cimetière : vous pouvez cibler 1 carte sur le Terrain ; envoyez-la au Cimetière.",Supports archetypes /Burning Abyss,,Sends from hand to Graveyard for cost/Sends from your hand to your Graveyard/Sends from field to Graveyard/Activates from your Graveyard,Summon/Quick/Trigger,
62835876,Bien et Mal des Abysses Ardents,Unlimited(OCG)/Unlimited(TCG),MAGIE,,,,,,,,,,,,"Cette carte est utilisée pour Invoquer Rituellement ""Malacoda, Seigneur des Enfers des Abysses Ardents"". Vous devez aussi Sacrifier des monstres depuis votre main ou Terrain dont le Niveau total est égal à min. 6. Durant votre Main Phase, sauf le tour où cette carte a été envoyée au Cimetière : vous pouvez bannir cette carte depuis votre Cimetière, et envoyez 1 monstre ""Abysses Ardents"" depuis votre main au Cimetière ; ajoutez 1 carte ""Abysses Ardents"" depuis votre Deck à votre main. Vous ne pouvez utiliser cet effet de ""Bien et Mal des Abysses Ardents"" qu'une fois par tour.",Supports archetypes /Burning Abyss,,Tributes as an effect/Activates from your Graveyard/Sends from hand to Graveyard for cost/Adds from Deck to hand,Effect/Ignition-like/Condition,
34614289,Bloqueur U.A.,Unlimited(OCG)/Unlimited(TCG),TERRE,[Guerrier/Effet],,,,,Niveau 7,1600,2700,,,,"Vous pouvez Invoquer Spécialement cette carte (depuis votre main) en renvoyant 1 monstre ""U.A."" que vous contrôlez (""Bloqueur U.A."" exclu) à la main. Vous ne pouvez Invoquer Spécialement ""Bloqueur U.A."" qu'une fois par tour de cette façon. Une fois par tour, lorsque votre adversaire Invoque Spécialement un ou plusieurs monstres : vous pouvez changer leur position de combat, et si vous le faites, annulez leurs effets.",Supports archetypes /U.A.,,Returns from your field to your hand/Activates upon Special Summon/Changes battle positions,Summon/Condition/Trigger,
61613388,Tactiques de Rotation U.A.,Unlimited(OCG)/Unlimited(TCG),MAGIE,,,,,,,,,,,,"Si vous contrôlez min. 2 monstres ""U.A."" de noms différents : mélangez autant de monstres sur le Terrain que possible dans le Deck, puis Invoquez Spécialement un nombre de monstres ""U.A."" depuis votre Deck qui ont chacun des noms différents, inférieur ou égal au nombre de cartes mélangées dans votre Main Deck, mais ces monstres ne peuvent pas attaquer ce tour. Puis votre adversaire peut Invoquer Spécialement un nombre de monstres depuis son Deck, inférieur ou égal au nombre de cartes mélangées dans son Main Deck. Vous ne pouvez activer qu'1 ""Tactiques de Rotation U.A."" par tour.",Supports archetypes /U.A.,,Returns from field to Deck,Activation requirement/Effect/Condition,
01826676,Chevalier Jouet,Unlimited(OCG)/Unlimited(TCG),TERRE,[Machine/Effet],,,,,Niveau 4,200,1200,,,,"Non Invocable Spécialement depuis le Deck. Si votre adversaire contrôle plus de monstres que vous, vous pouvez Invoquer Spécialement cette carte (depuis votre main). Lorsque cette carte est Invoquée Normalement ou Spécialement : vous pouvez Invoquer Spécialement 1 ""Chevalier Jouet"" depuis votre main.",,,Activates from your hand/Activates upon Normal Summon/Activates upon Special Summon,Summon/Trigger,
64605089,Épéiste de Révélation de la Lumière,Unlimited(OCG)/Unlimited(TCG),LUMIÈRE,[Guerrier/Effet],,,,,Niveau 8,0,2400,,,,"Lorsqu'un monstre de votre adversaire déclare une attaque directe : vous pouvez Invoquer Spécialement cette carte depuis votre main, puis si la DEF de cette carte est supérieure à l'ATK du monstre attaquant, détruisez le monstre attaquant. Un Monstre Xyz qui a été Invoqué en utilisant cette carte sur le Terrain comme Matériel Xyz gagne cet effet.●Chaque tour, la première fois que cette carte va être détruite au combat, elle n'est pas détruite.",Xyz Monster,,Activates upon attack declaration/Grants effect as Xyz Material,Trigger/Unclassified/Continuous,
